authors,category,content,date,id,img_src,section,tags,title,topics,url
Ingrid Lunden,Collaborative Consumption,"As outsized ridesharing companies like Uber and Lyft continue to build out their taxi-style marketplaces largely based around connecting individual passengers to individual drivers, a startup focused squarely on the carpooling opportunity has raised a large round of funding to expand outside of the U.S.
Via — which has developed a shuttle-based carpooling service that it offers directly in the U.S. for a flat-rate starting at $5, as well as through platform partnerships with other transportation providers — has raised what it is describing as a “strategic investment” led by German automaker Daimler to expand into Europe as well as to work more closely on other business opportunities together. Alongside this, Daimler’s Mercedes Benz division is investing $50 million into a joint venture with the startup. The full amount of funding has not been disclosed, but we understand from a source very close to the deal that it is $250 million.
The sizeable funding underscores ongoing momentum in the transportation industry to build more tech-based solutions, updating outmoded legacy infrastructure with more efficient services that can meet the new demand for on-demand. Services like Uber’s — even amidst all of the controversy around its work culture and upheaval in its executive leadership — have been gaining ground as an alternative to car ownership, but they are also eating into the business of mass-transit services. 
While carpooling — where people come together in small groups to ride in the same general direction in a single car — is something that the Ubers of the world are also offering, it also presents a window of opportunity to those mass transit companies to better compete against transportation-on-demand services, and fill a hole to serve consumers who might be weighing up alternatives.
“What you’ve seen in the last few years is that the solution for on-demand shuttles has gained a lot of momentum,” CTO and co-founder Oren Shoval (who co-founded the company with Daniel Ramot) told TechCrunch in an interview. “A lot of local stakeholders have licensed our platform.” The company is also embarking on a big recruitment drive with this round. 
Other investors are not being revealed at this stage — Daimler is having a signing ceremony today to commemorate its specific involvement — but backers in this round include some of the company’s previous investors. Before this round, Via had raised $137 million with investors including 83North, C4 Ventures, Ervington Investments, Expansion Venture Capital, Hearst Ventures, Kapor Capital, Lior Prosor, Pitango, Planven, Poalim and RiverPark. Pitango had led Via’s previous two rounds, a $100 million Series C and a $27 million Series B.
The valuation is also not being disclosed, but a source tells us that it is a ‘definite upround.’ According to market analytics firm Zirra, the pre-money valuation for Via was between $450 million and $500 million. Based on that, at a rough estimate, that would put the valuation for Via now at $750 million.
Shoval said that the investment will see Via expanding its own-branded operations in Europe, initially in London, with Paris soon to follow. Via is also going to come to more markets in the U.S.: today, it’s live in New York, Chicago, and Washington DC and says it’s providing over 1 million rides per month, but it has also run smaller programs in Austin, TX and Orange County, CA, so those regions could be two likely targets for further expansion.
What’s interesting about Via is that while it is building its direct to consumer, own-brand operations, it also has been inking licensing deals with third parties that are already established in various places. These include partnerships with Arriva and Keolis, two mass-transit companies that operate city buses, train services and more in multiple counties. (Arriva is part of Germany’s Deutsche Bahn and Keolis’ parent is SNCF of France.)
Arriva and Keolis are licensing Via’s operating system to build their own carpooling trials. “This is an example how we use our tech to let companies transition to dynamic, real time solutions,” said Shoval. “It’s much more efficient to offer dynamic solutions using smaller vehicles instead of large busses.” He added that there is also potential to use Via’s platform to help direct traffic for other vehicles they operate.
Shoval said that the Daimler deal getting announced today will encompass investments and partnerships to expand these two existing business lines, and more.
Via has been in partnership with Daimler for years already, including working on the pilot in Orange County using Mercedez Benz vehicles. 
This Via investment presents a number of opportunities to Daimler. One is that it gives Daimler a bigger sales funnel in providing vehicles for such services. In particular, a Via partnership can help in their own R&D and design work for new vehicles optimised for carpooling and other on-demand transportation. “One big question [for the future of transportation] is, ‘what is the right vehicle?'” Shoval said. “There are the seating arrangements, how you connect the sensors, what kind of door it should have. This is a big piece of mobility.”
It will also give Daimler an opportunity to embed technology and sensors in those vehicles that can make other ridesharing services more efficient. “We also believe that the vehicles in the network, at the end of the day, it’s not just an app but a whole service that you are getting. It makes sense to have these things converge,” said Shoval. 
Lastly, it gives Daimler a chance to get behind the wheel (so to speak) of the transportation service itself, thus developing a business around recurring service revenues.
Daimler is no stranger to the ridesharing business, or indeed in investing around transportation. Similar to other automakers like Volkswagen and GM, the company has made a number of investments and acquisitions in the last several years around transportation technology and also transportation services themselves. They include an owning stake in Here, the mapping business; investments in Careem and car-tech services like Momenta; and the acquisition of myTaxi and the many operations that now form a part of that like Hailo and TaxiBeat.
“On-demand ride-sharing offers many new ways of making city traffic efficient, needs-based and sustainable – especially when it involves the use of spacious, safe and comfortable vans,” says Volker Mornhinweg, Head of Mercedes-Benz Vans, in a statement. “Via is one of the most successful providers in the growing ride-sharing sector while Mercedes-Benz Vans has the perfect vehicles that are being continuously optimized for this job. By deepening our cooperation with Via, we are thus taking the next logical step in the context of our strategy for the future and are expanding our range of new mobility services.”",2017-09-04,1535669,https://tctechcrunch2011.files.wordpress.com/2017/09/via-product-shot-2017.jpg?w=738,europe/,"transportation,carpooling,via,daimler",Via raises $250M led by Daimler to bring its carpooling technology to Europe,,https://techcrunch.com/2017/09/04/via-raises-250m-led-by-daimler-to-bring-its-carpooling-technology-to-europe/
Steve O'Hear,Europe,"Habito, a London startup that is bringing the entire mortgage process online, has raised £18.5 million in Series B funding. Atomico, the European VC firm founded by Skype’s Niklas Zennström, led the round, with participation from existing investors Ribbit Capital, Mosaic Ventures, and Revolutionary (Ad)Ventures. It brings the total raised by the U.K. company to just over £27 million.
More interestingly, Habito, which probably counts Trussle as its closest direct competitor, says the new capital will in part be used to integrate its technology with major retail banks and high street lenders to facilitate “real-time mortgage approvals”, in addition to marketing and other product development. The startup says it also plans to expand its offering to other parts of the mortgage process, namely home and life insurance.
Calling itself a “digital mortgage broker,” Habito was founded by Daniel Hegarty, who was previously an early employee at Wonga, to remove a lot of the friction when applying for a mortgage. The company’s tech claims to analyse over 11,000 mortgage products across 70
lenders in real-time, to help identify the most suitable mortgage based on your individual circumstances. The entire application process can then be completed via the Habito app/website for free, thus eliminating the fees that most traditional mortgage brokers charge.
There is, however, an additional aspect to the Habito premise, and one that has the potential to be quite disruptive beyond pricing. Once you’ve signed up to the app and entered all of the required details related to your eligibility and your current mortgage and property (if you have one), the startup will effectively become your broker going forward.
This sees its tech continually monitor the mortgage products available on the market and alert you if it thinks you have become mismatched and therefore are paying over the odds. The idea is to make switching also as frictionless as possible. That’s because, says Habito, 1 in 4 British homeowners are currently mismatched, paying lenders an average of around £4,000 more than they need to every year.
“Fintech companies are tackling a lot of traditional areas that are ready for a new approach. This is one of them,” Atomico Partner Niall Wass tells TechCrunch. “Matching borrowers and lenders in the residential mortgage space is slow, expensive and very fragmented – with around 15,000 largely offline brokers in the U.K. But the potential is not just in the U.K., it’s across multiple markets with the same problem.”
However, despite describing the Habito value proposition for both borrowers and lenders as being pretty clear, Wass says one challenge the startup faces is the degree of apathy by house owners when it comes to remortgaging.
“This apathy is why there is such massive overspend in this market globally – perhaps because the process to move to a better mortgage has been so slow and complicated. So the first challenge is continuing to make the process simple, speedy, free and with a better outcome for the borrower. This is absolutely key,” he says.
“I love the idea that Habito has your back and will check the market automatically for a better deal for you – but that kind of message has to get out, so the next challenge is to help build the brand”.
In addition, the Atomico VC says that Habito will need to further prove the benefits to lenders too by using more technology to make it easier and cheaper to “assess the customer risk and matching them to the most appropriate product”. Hence plans to integrate with major retail banks and high street lenders at the technology level.",2017-09-03,1535517,https://tctechcrunch2011.files.wordpress.com/2017/09/habito-press-image-2.jpg?w=738,europe/,"atomico,trussle","Habito, an app that helps you find the right mortgage, raises £18.5M Series B led by Atomico",,https://techcrunch.com/2017/09/03/habito-atomico/
Steve O'Hear,Europe,"De-cloaking today is a new startup from two of the founders of defunct food delivery company Take Eat Easy. Dubbed Cowboy, the company is building a new electronic bicycle that it claims will address issues that have historically stopped e-bikes from becoming a “fully fledged mobility solution”.
“We haven’t launched yet,” Cowboy co-founder Adrien Roose tells me. “We are still entirely focusing on product development. After six months of design, engineering and industrialisation, we now have a first fully functional prototype. We will keep iterating on the product in the coming months, with the objective to launch early Spring 2018”.
Specifically, the Cowboy bike aims to better previous e-bikes in terms of pricing, product design, and technology — with the broader mission to “improve urban mobility by increasing the popularity of electric bikes”.
Key features include what Roose says is an intuitive and automatic motor assistance, a removable semi-integrated “smart battery,” and an app to turn the bike on and off and support theft detection, including GPS tracking. In addition, Cowboy plans to offer remote troubleshooting and software updates.
The distribution model of Cowboy is a classic online play, too. The startup says it will sell the e-bike through direct channels, allowing for “disintermediated” pricing of €1,399.
“As a digital native vertical brand, we’ve developed our own technology, allowing us to control both product design and production cost. To develop a connection with our customers, and lower prices, we will only distribute our product through direct sales channel,” adds Roose.
Cowboy’s other founders are Karim Slaoui, who along with Roose previously co-founded Brussels and London-based Take East Easy, an early Deliveroo competitor, and Tanguy Goretti, who was previously co-founder and CEO of Djump, an early competitor to Uber Pop in Europe.",2017-08-31,1533510,https://tctechcrunch2011.files.wordpress.com/2017/08/cowboybike-21.jpg?w=738,europe/,,Cowboy is a new e-bike startup from founders of Take Eat Easy,,https://techcrunch.com/2017/08/31/cowboy-bike/
Natasha Lomas,Artificial Intelligence,"A wide-ranging, UK government-commissioned industrial strategy review of the life sciences sector, conducted by Oxford University’s Sir John Bell, has underlined the value locked up in publicly funded data held by the country’s National Health Service — and called for a new regulatory framework to be established in order to “capture for the UK the value in algorithms generated using NHS data”.
The NHS is a free-at-the-point of use national health service covering some 65 million users — which gives you an idea of the unique depth and granularity of the patient data it holds.
And how much potential value could therefore be created for the nation by utilizing patient data-sets to develop machine learning algorithms for medical diagnosis and tracking.
“AI is likely to be used widely in healthcare and it should be the ambition for the UK to develop and test integrated AI systems that provide real-time data better than human monitoring and prediction of a wide range of patient outcomes in conditions such as mental health, cancer and inflammatory disease,” writes Bell in the report.
His recommendation for the government and the NHS to be pro-active about creating and capturing AI-enabled value off of valuable, taxpayer-funded health data-sets comes hard on the heels of the conclusion of a lengthy investigation by the UK’s data protection watchdog, the ICO, into a controversial 2015 data-sharing arrangement between Google-DeepMind and a London-based NHS Trust, the Royal Free Hospitals Trust, to co-develop a clinical task management app.
In July the ICO concluded that the arrangement — DeepMind’s first with an NHS Trust — breached UK privacy law, saying the ~1.6M NHS patients whose full medical records are being shared with the Google-owned company (without their consent) could not have “reasonably expected” their information to be used in this way.
And while the initial application the pair have co-developed does not involve applying machine learning algorithms to NHS data, a wider memorandum of understanding between them sets out their intention to do just that within five years.
Meanwhile, DeepMind has also inked additional data-sharing arrangements with other NHS Trusts that do already entail AI-based research — such as a July 2016 research partnership with Moorfields Eye Hospital that’s aiming to investigate whether machine learning algorithms can automate the analysis of digital eye scans to diagnose two eye conditions.
In that instance DeepMind is getting free access to one million “anonymized” eye scans to try to develop diagnosis AI models.
The company has committed to publishing the results of the research but any AI models it develops — trained off of the NHS data-set — are unlikely to be handed back freely to the public sector.
Rather, the company’s stated aim for its health-based AI ambitions is to create commercial IP, via multiple research partnerships with NHS organizations — positioning itself to sell trained AI models as a future software-based service to healthcare organizations at whatever price it deems appropriate.
This is exactly the sort of data-enabled algorithmic value that Bell is urging the UK government to be pro-active about capturing for the country — by establishing a regulatory framework that positions the NHS (and the UK’s citizens who fund it) to benefit from data-based AI insights generated off of its vast data holdings, instead of allowing large commercial entities to push in and asset strip these taxpayer-funded assets.
“[E]xisting data access agreements in the UK for algorithm development have currently been completed at a local level with mainly large companies and may not share the rewards fairly, given the essential nature of NHS patient data to developing algorithms,” warns Bell.
“There is an opportunity for defining a clear framework to better realise the true value for the NHS of the data at a national level, as currently agreements made locally may not share the benefit with other regions,” he adds.
In an interview with the Guardian newspaper he is asked directly for his views on DeepMind’s collaboration with the Royal Free NHS Trust — and describes it as the “canary in the coalmine”.
“I heard that story and thought ‘Hang on a minute, who’s going to profit from that?’” he is quoted as saying. “What Google’s doing in [other sectors], we’ve got an equivalent unique position in the health space. Most of the value is the data. The worst thing we could do is give it away for free.”
“What you don’t want is somebody rocking up and using NHS data as a learning set for the generation of algorithms and then moving the algorithm to San Francisco and selling it so all the profits come back to another jurisdiction,” Bell also told the newspaper.
In his report, Bell also highlights the unpreparedness of “current or planned” regulations to provide a framework to “account for machine learning algorithms that update with new data” — pointing out, for example, that: “Currently algorithms making medical claims are regulated as medical devices.”
And again, in 2016 DeepMind suspended testing of the Streams app it had co-developed with the Royal Free NHS Trust after it emerged the pair had failed to register this software as a medical device with the MHRA prior to trialling it in the hospitals.
Bell suggests that a better approach for testing healthcare software and algorithms could involve sandboxed access and use of dummy data — rather than testing with live patient data, as DeepMind and the Royal Free were.
“One approach to this may be in the development of ‘sandbox’ access to deidentified or synthetic data from providers such as NHS Digital, where innovators could safely develop algorithms and trial new regulatory approaches for all product types,” he writes.
In the report Bell also emphasizes the importance of transparency in winning public trust to further the progress of research which utilizes publicly funded health data-sets.
“Many more people support than oppose health data being used by commercial organisations undertaking health research, but it is also clear that strong patient and clinician engagement and involvement, alongside clear permissions and controls, are vital to the success of any health data initiative,” he writes.
“This should take place as part of a wider national conversation with the public enabling a true understanding of data usage in as much detail as they wish, including clear information on who can access data and for what purposes. This conversation should also provide full information on how health data is vital to improving health, care and services through research.”
He also calls for the UK’s health care system to “set out clear and consistent national approaches to data and interoperability standards and requirements for data access agreements” in order to help reduce response time across all data providers, writing: “Currently, arranging linkage and access to national-level datasets used for research can require multiple applications and access agreements with unclear timelines. This can cause delays to data access enabling both research and direct care.”
Other NHS-related recommendations in the report include a call to end handwritten prescriptions and make eprescribing mandatory for hospitals; the creation of a forum for researchers across academia, charities and industry to engage with all national health data programs; and the creation of between two and five digital innovation hubs to provide data across regions of three to five million people with the aim of accelerating research access to meaningful national datasets.",2017-08-31,1534283,https://tctechcrunch2011.files.wordpress.com/2015/11/shutterstock_159747701.jpg?w=738,europe/,"machine-learning,united-kingdom,national-health-service,health-care","Building health AIs should be UK ambition, says strategy review",,https://techcrunch.com/2017/08/31/building-health-ais-should-be-uk-ambition-says-strategy-review/
