authors,category,content,date,id,img_src,section,tags,title,topics,url
Steve O'Hear,Europe,"VizEat, the European “social eating platform” that connects travellers and local hosts around authentic food experiences — such as dining in a local’s home, cooking classes, and food tours — has acquired EatWith, a similar startup headquartered in San Francisco.
Terms of the deal are undisclosed. EatWith is thought to have raised over $8 million from backers such as Greylock Partners, which led the company’s Series A round in late 2014.
“As a policy, we don’t disclose deal terms,” a spokesperson for VizEat tells me. “VizEat will be acquiring EatWith.com as an entire entity (including website and current ongoing activity) to expand its global offering of immersive food experiences with locals. EatWith hosts will also be given access to the wider offering for the group’s global partners with the tourism and travel industry, both online and traditional”.
Furthermore, I understand that EatWith’s founders had already left the startup, but that key team members of the EatWith team in San Francisco and Tel-Aviv are joining the combined entity. “They will manage and expand the host community and the partnerships. More hires will be done in the coming months,” says VizEat. In addition, EatWith will continue its existing partnership with TripAdvisor, which CrunchBase also lists as a backer.
Meanwhile, VizEat says the acquisition of EatWith makes it the leader for enabling social eating experiences with locals and puts the startup at the forefront of the sharing economy within the food and travel sectors. It claims more than 25,000 hosts across 130 countries, with localised versions of its app available in English, French, German, Italian, Spanish, and Chinese.
The roll up of EatWith follows a similar acquisition in 2015 when the company gobbled up Paris-based Cookening, an early pioneer in the dine with a local space.",2017-09-07,1536120,https://tctechcrunch2011.files.wordpress.com/2017/09/cracc83c2a9dit-karma-spies.jpg?w=738,europe/,"eatwith,vizeat",European ‘social eating platform’ VizEat acquires U.S.-based EatWith,,https://techcrunch.com/2017/09/07/vizeat-swallows-eatwith/
Mike Butcher,Europe,"As the Blockchain and Crypto world gathers pace, vehicles to allow for the creation, promotion and management of crypto investment funds are growing. The Iconomi Digital Assets Management Platform enables users to invest and manage various digital assets. Meanwhile, Melonport is building a blockchain protocol for digital asset management, initially built on the Ethereum platform. This is basically a framework for blockchain-enabled hedge funds.
Right now, most tokenized investment vehicles are either fully crypto-oriented or pegged to a tradable asset, like the U.S. dollar or gold. But creating access to fiat investment opportunities would diversify the income sources while at the same time retaining all the benefits of the crypto universe, such as transparency. Additionally, investors would get a higher return, because tokenized funds are much more cost-efficient than traditional ones.
Now, Blackmoon Financial Group, a financial technology and investment management company, has launched Blackmoon Crypto (BMC), a blockchain-based platform for — guess what — tokenized investment funds. BMC claims it has found a way to make crypto investments legal and secure, which would be significant, given the recent SEC decision to classify some tokens as securities.
The move might not be considered so worthy of note, were it not for the fact that these are not a bunch of pie-in-the-sky, fly-by-night crypto cowboys. For one, the company has attracted $3.5 million in venture capital investment from Target Global, AN&N Investments, Flint Capital, and several other private investors. And right now, Blackmoon’s lending marketplace is operating in 9 countries and exceeds $100M in deals volume, while reaching $13M in monthly volumes.
Last Friday it passed a $10M pre-ICO threshold with more than 2500 paid accounts. As a result, BMC closed its pre-sale after the first 2 weeks, indicating a strong public interest in the project and the forthcoming ICO. It’s ICO is now slated for September 12th.
The idea is to offer a new standard for tokenized investment vehicles that will bridge the gap between fiat and crypto universes by creating a way for asset managers to create and manage legally compliant tokenized funds. This would include everything from technology and infrastructure to legal framework and corporate structuring. Eventually any experienced and approved investment manager would be able to create a fund based on Blackmoon Crypto’s platform. (The platform and its tokens are based on Ethereum and also the Waves blockchain).
The company is led by entrepreneurs and investors Oleg Seydak and Ilya Perekopsky (former VP and COO of VK, the Facebook clone previously founder buy Pavel Durov, who went on to create Telegram).
In addition, two well-known players in asset management are supporting the ICO. The first is Nicolas Tranter – founding director of Bibbsworth, which advises institutional asset managers in the UK and Europe, and is based in London. The other is John Hyman – partner at Ondra Partners, a leading corporate finance advisory boutique.
“Setting up the proper investment structure is a costly endeavour. Not all tokenized funds do this, which leads to greater regulatory risk for investors,” says Seydak. He thinks there needs to be an industry standard for setting up tokenized investment vehicles that would then be able to attract investments from private individuals and institutional investors of any kind. “That’s what the Blackmoon Crypto platform does; it pays attention to regulatory risk and bridges the gap between the fiat and crypto worlds.”
“Tokenized funds are more cost-efficient thanks to lower infrastructure and setup costs,” Sergey Vasin, Chief Investment Officer of Blackmoon. “This economy is transmitted to investors in the form of higher net return. The cherry on top is that, fund tokens are also immediately tradable.”",2017-09-06,1536913,https://tctechcrunch2011.files.wordpress.com/2017/04/gettyimages-634632760.jpg?w=738,europe/,blackmoon,Blackmoon to ICO its blockchain-based platform for tokenized investment funds,,https://techcrunch.com/2017/09/06/blackmoon-to-ico-its-blockchain-based-platform-for-tokenized-investment-funds/
Natasha Lomas,Asia,"Apple is preparing to draw scores of eyes to Cupertino later today as it unboxes a clutch of new iPhones, including a new premium handset, called the iPhone X, slated to have a near bezel-less OLED display, a 3D face unlock feature and a $1,000+ price-tag, while bringing various new camera and feature tweaks — many of which have leaked in recent weeks.
Even so, the new iPhones are set to look like, well, iPhones — aka slabs of expensively shiny glass.
So what better time for rival Samsung to tease that it might finally be nearing the point of outing something rather different: A smartphone with a foldable screen — encouraging consumers who might be thinking of shelling out serious bucks for Apple’s new glass slabs to think twice.
Bloomberg reports that Koh Dong-jin, president of Samsung’s mobile business, has said the company is setting its sights on 2018 to release a smartphone with a bendable display.
“As the head of the business, I can say our current goal is next year,” he told reporters. “When we can overcome some problems for sure, we will launch the product.”
He was speaking at a press event in South Korea announcing the Galaxy Note 8 phablet to domestic media. The future foldable phone is intended to sit in the same Galaxy Note portfolio line-up, according to his comments.
Samsung has been teasing the fact it’s working on a bendable device for multiple years now — showing investors a range of folding prototypes in 2013, and teasing bendy screen concepts (branded Youm) at CES that year. Though its tests date back further still, while it’s been showing off concept videos of flexible devices for a similarly long time.
But while Samsung has been happy to scatter suggestive tidbits about its folding phone plans over the years, the date for a potential commercial release has never been firmed up. Instead possible release years have been mentioned then pushed further forward in time — apparently as it encountered new manufacturing complications.
So it’s fair to say that the latest claim — that 2018 might finally be the year of the folding phone  — should be taken with a large pinch of salt. Especially as the timing of the tease coincides with the most important date in the Apple calendar: iPhone X day.
And, well, let’s face it, concept smartphones don’t have a great record of ever seeing the light of day either.
Even if you assume Samsung has made some progress on its bendable prototypes, having worked on the concept for more than five years at this point, there’s no doubt that creating a screen robust enough to be opened and closed (and prodded) as much as 150 times+ a day by touchscreen-addicted humans is a huge challenge.
And after the flaming disaster of the Galaxy Note 7, which had to be recalled after some batteries caught fire, the risk-margin for Samsung on this potential release must be very tight indeed…
No one wants a folding phone if that means screen glitches and/or a handset that feels tacky and whose dimensions hark back to the heft of late 1990s mobile devices.
(For the record, Samsung’s folding phone has been rumored to be called the Galaxy X. So Apple’s choice of premium brand name for its top tier new iPhone is probably causing more than a little irritation in South Korea.)
We’re liveblogging Apple’s launch event here, and here’s details on how to watch the keynote. So stay tuned for all the news from Cupertino.
Bloomberg also reported Samsung’s Dong-jin saying it’s working with audio device maker Harman, which it acquired last year, to develop an artificial intelligence-enabled speaker for voice commanding to play music and conduct other tasks — aka an Amazon Echo inspired Apple HomePod clone in the making.",2017-09-12,1539162,https://tctechcrunch2011.files.wordpress.com/2017/04/img_2729.jpg?w=738,asia/,"smartphone,harman,iphone","Ahead of iPhone X day, Samsung teases 2018 foldable phone launch plan",samsung,https://techcrunch.com/2017/09/12/ahead-of-iphone-x-day-samsung-teases-2018-foldable-phone-launch-plan/
Jon Russell,Asia,"Southeast Asia-based fashion marketplace Zilingo has closed an $18 million Series B funding round led by Sequoia Capital India and Burda Principal Investments.
Zilingo was founded less than two years ago by ex Sequoia analyst Ankiti Bose (CEO) and former Yahoo engineer Dhruv Kapoor (CTO). The basic vision is to help Southeast Asia’s thriving independent fashion sellers and boutiques stores expand their businesses online.
The startup had existed largely under the radar until it raised $8 million around one year ago. This newest round includes participation from existing backers Venturra Capital, SIG, Beenext and Wavemaker, as well as new investors — two angels — Tim Draper and Manik Arora, ex IDG Ventures India head, via his family office fund.
This new funding is being put to work growing Zilingo’s presence in Southeast Asia, and particularly Indonesia — the region’s largest economy. The startup said it has grown its revenue over 10-fold and added 5,000 new merchants during the past twelve months. It currently ships to eight countries, with seller hubs in Thailand, Indonesia, Hong Kong, Korea, Vietnam and Cambodia, with five company offices.
“A large part of this round is dedicated to growing in Indonesia,” CEO Bose told TechCrunch in an interview. “There’s no other comparable fashion brand, so we probably have a window of about a year to make to big before others follow.”
Zilingo expanded into Indonesia earlier this year after Bose relocated to Jakarta to learn more about the market. Some six months into operating there, she’s impressed by the opportunities of the country.
“I’ve never seen a market that’s so ready to consume consumer internet products,” she said. “We are seeing 85 percent growth each month, that’s not something anyone has seen in other Southeast Asia markets. People spend a bit less on every transaction, but the behavior is crazy and they shop more times.”
“We were initially really worried about logistics, because Indonesia is an archipelago, but it hasn’t been that hard. If your expectations are correctly set, it’s a great market,” the Zilingo CEO added.

Aside from aiming to grow its share of the local market, Zilingo is also making moves overseas. It has just opened a B2B network that will allow fashion sellers in the U.S. and parts of Europe to purchase items direct from Zilingo at a competitive price for local resale.
“There’s demand for that supply outside of Southeast Asia,” Bose said. “If you run a boutique in Europe or America, it’s likely you are procuring products from Asia but there are a lot of middlemen.”
For now though, the primary focus is Southeast Asia at this point.
Bose added that she’s particularly excited to work with Burda, which has emerged as one of the few traditional Series B investors in Southeast Asia after hiring ex-GREE investor Albert Shyy to head up the region.
“These guys bring a whole new perspective on fashion and lifestyle,” she said in reference to Burda’s investment in Etsy and its global media portfolio, which includes brands such as Elle, Harper’s Bazaar, and InStyle.
“It seems only yesterday that Zilingo started with a seed round from Sequoia India and most of the team based out of the Sequoia incubation space in Bangalore. It is terrific to see how they have progressed towards building the leading fashion and lifestyle e-commerce company in Southeast Asia,” said Shailendra Singh, managing director at Sequoia Capital India — another Zilingo backer — in a statement.",2017-09-12,1539151,https://tctechcrunch2011.files.wordpress.com/2017/09/zilingo-ios.jpg?w=738,asia/,"southeast-asia,craftsvilla,california,sequoia-capital",Zilingo raises $18M for its fashion e-commerce service in Southeast Asia,,https://techcrunch.com/2017/09/12/zilingo-raises-18m/
Jon Russell,Asia,"Xiaomi is shooting a number of arrows at Apple today. Smartphones aside, it just launched an affordable take on the Macbook Air that ships with Windows.
The first Xiaomi laptop was a shot at the Macbook Air when it was unveiled in the summer of 2016, and the company is back with its take on Apple’s more expensive computer. The Mi Notebook Pro — because all comparisons start with the name — sports a 15.6-inch display and is powered by an Intel Core i7 processor with up to 16GB RAM and an Nvidia GeForce MX150 graphics chip. That combination makes it an apparent 40 percent times more powerful than the Mi Notebook Air from last year, Xiaomi said.
Elsewhere, the newest machine includes a fingerprint sensor inside the trackpad, three-in-one SD card support, USB-C and regular USB ports, a headphones jack and a full HDMI slot. Xiaomi wasted no time highlighting that this selection offers far more options than the latest in Apple’s own Macbook Pro series.
Last year’s Mi Notebook came in around the 3599 RMB mark, but the Pro version is a little pricier. Models start from 5599 RMB ($858) for an i5 chipset with 8GB. The i7 version comes with 8GB for 3699 RMB ($980) or 16GB for 6999 RMB ($1072).
Release-wise, it looks like another China-only product unless we hear otherwise from Xiaomi.
Those based outside of China can at least take heart in the release of two other devices today that seem certain for global availability. The new and impressive Mi Mix 2 smartphone, and the revamped Mi Note 3 phablet.",2017-09-11,1538669,https://tctechcrunch2011.files.wordpress.com/2017/09/mi-notebook-pro-1.jpg?w=738,asia/,"home-automation,computing",Xiaomi takes aim at Apple with a Macbook Pro rival priced from $858,"xiaomi,steve-jobs",https://techcrunch.com/2017/09/11/xiaomi-mi-notebook-pro/
Jon Russell,Asia,"It’s the day before iPhone launch and Xiaomi is back at it again with the unveiling of the follow-up to last year’s highly-acclaimed and near-bezel-less Mi Mix smartphone.
The Mi Mix 2 keeps the previous design aesthetic — developed by a team led by designer Philippe Starck — but with a slightly smaller six-inch display and improved 18:9 screen resolution. The bezel is minimal once again, and the Chinese phone maker claims to have trimmed the lower border down by a significant 12 percent.
It’s a pretty striking look — once again — and it fits with the biggest trend in devices this year, minimizing the bezel in exchange for maximum front screen size. It’s a train that Samsung, LG and (reportedly) Apple have all bordered to help stand out from the rest. Xiaomi went a little further last year when it removed the front speaker to optimize the screen, and it’s the same story this year. Again, it has opted for a piezoelectric ceramic acoustic technology setup to minimize the speaker, but this time it actually occupies some space on the device rather than being buried last year, which had caused some audio issues.
There are some notable internal upgrades, including a higher quality camera that uses a Sony IMX386 sensor — bringing it up to par with the Mi 6 — and Qualcomm’s new Snapdragon 835 processor and 6GB RAM powering the phone.
The options start at 3299 RMB ($506) for 64 GB of storage, with 3599 RMB ($550) for 128 GB and 3999 RMB ($613) for 256 GB. A special edition model that includes an impressive ceramic unibody and pairs 8GB RAM with 128 GB of storage is on offer for a more pricey 4699 RMB, or around $720.
As it did last year, Xiaomi also used the Mix Mix launch to out its newest Mi Note smartphone.
The Mi Note 3 appeared today a little smaller than before — 5.5-inches — with a Snapdragon 660 processor, 3,500 mAh battery and 6GB RAM. There’s a 16-megapixel selfie camera and 12-megapixel dual-lens arrangement for the rear-side camera, including 2X optic zoom, portrait mode and four-axis optical image stabilizer (OIS).
The new Mi Note comes in at 2499 RMB ($383) for 64 GB, 2899 RMB ($445) for 128 GB and 2999 RMB ($460) for 128 GB.

These new devices follow the launch last week of Xiaomi’s first stock Android device — the very fine-looking Mi A1 — which falls under Google’s Android One program. These new arrivals today both operate on its MI UI Android software fork, however.
This year has been a period of recovery for Xiaomi, which saw its once-explosive sales growth slacken over the past two years as it came to terms with aggressive rivals in China and the difficult challenge of growing its presence outside of its homeland.
CEO Lei Jun, who declined to disclose annual sales figures for the first time earlier this year, hailed his company’s recovery this summer. Sales in China jumped 60 percent from Q1 2017 to Q2 2017 leading Lei to claim Xiaomi had reached “a major inflection point” in its growth.
“After two years of internal recalibration, Xiaomi is once again embarking on a rapid growth trajectory,” he said in a letter to employees.
With three attractive news devices launched this month alone, Xiaomi will be hoping to build on its promising year as 2017 closes out and 2018 comes along.",2017-09-11,1538645,https://tctechcrunch2011.files.wordpress.com/2017/09/mix-max-2-6.jpg?w=738,asia/,"computing,video,technology,ios",Xiaomi unveils second bezel-less Mi Mix smartphone and new Mi Note phablet,,https://techcrunch.com/2017/09/11/xiaomi-mi-mix-2-mi-note-3/
Romain Dillet,Asia,"Another day, another crash and another Chinese ban. This time, as Reuters spotted, a single report from financial news site Caixin is saying that the Chinese government is considering banning cryptocurrency exchanges in China.
In particular, the report is saying that Chinese citizens won’t be able to use exchanges to buy bitcoins, ethers and more using Chinese yuan, and vice versa.
Cryptocurrencies aren’t banned per se, just exchanges. But do bitcoins have value in China if you can’t exchange them? That’s the main question and the reason why cryptocurrencies are crashing.
This is what it looks like on coinmarketcap.com right now:

Bitcoin is currently down 7.7 percent, Ethereum is down 11 percent, Bitcoin Cash (which is quite popular in China) is down 11.2 percent, etc. But if you go on Chinese exchanges, the crash is even more important. For instance, Bitcoin is down 13.4 percent and Ethereum is down 18.4 percent on OKCoin.
As always, it’s a bit hard to know for sure what’s going to happen. There’s only a single report about this decision. Chinese investors could be trying to exit cryptocurrency markets as quickly as possible because they risk being locked into cryptocurrencies.
Those exchanges have already been regulated with KYC (know your customer) rules and anti-money laundering rules. Margin trading is also forbidden in China.
Maybe the Chinese government wants even more control and is going to create a centralized exchange and regulate those markets as much as possible. It’s hard to know for sure as Chinese regulation is always very sudden.
Earlier this week, the Chinese government banned ICOs in China. There’s currently an ICO freeze and the top 60 ICO platforms are being investigated. Authorities thought ICO tokens were like securities, and some of them were a scam.
This isn’t the first time China is banning exchanges. Back in 2013, bitcoin dropped more than 50 percent as the government asked BTCChina to stop accepting deposits in Chinese yuan. The government changed its mind later on.",2017-09-08,1537992,https://tctechcrunch2011.files.wordpress.com/2017/03/bitcoin-on-gold1.png?w=738,asia/,"china,cryptocurrency",Bitcoin price drops following report that China is going to shut down local exchanges,bitcoin,https://techcrunch.com/2017/09/08/bitcoin-price-drops-following-report-that-china-is-going-to-shut-down-local-exchanges/
