authors,category,content,date,id,img_src,section,tags,title,topics,url
Sarah Perez,Apps,"Lightricks, the company behind the popular selfie-correcting app called Facetune, is adding to its line of mobile photography and editing tools with the recent launch of a new app called Quickshot. Like its other efforts in this space, Quickshot aims to make photo editing more accessible to amateurs. However, in this case, the app’s focus is to assist with taking photos, not just correcting them after the fact.
The app’s name references one tool in particular – a “quickshot” mode which will automatically align your photos, fix the lighting and preview filters before you even snap the picture. The idea is that you’ll be able to take better photos if you can see what they’ll look like before you press the capture button.
Other modes include the “strobe” mode that lets you capture action and movement by mimicking strobe lights and long exposures, and an “HDR” mode that helps with tricky lighting situations.

Beyond these different camera modes, the app also ships with a range of adjustable presets for various scenes, like portraits, nature, urban, and more. That way, novice photographers don’t have to fiddle with various settings to take the best photo, while more advanced users can load a preset then tweak it further to their liking.

The ability to customize your filter in order to give your photos a unique, personalized look is something that draws people to other top photo apps, like Instagram, Snapseed, and VSCO, for example. But with Quickshot, the larger idea is to combine favorite tools like photo filters with Lightricks’ understanding of making photo edits easier through tricks like instant fixes and other tools that can speed up the process.
For example, Quickshot’s batch editor that lets you adjust a single style – like the filter, brightness, depth and more – and then apply it multiple images all at once.

Quickshot is the latest app in a growing lineup of apps from Lightricks, which has been aiming to capitalize on its success with Facetune to launch a subscription business for its creativity tools. Earlier this summer, it debuted a new photo editor called Enlight Photofox, which is basically the upgraded version of the existing Enlight app.
It’s still somewhat rare to see this strategy play out on today’s App Store. Developers are often expected to roll out new features as upgrades to existing apps, not as new ones. Tweetbot, a Twitter client, has been one exception to this rule, which applies more so to apps than games. It’s far more common for sequels to arrive as their own standalone games, as with Monument 2, for instance.
Like Enlight Photofox and Facetune 2, Quickshot is also a subscription offering. While the app itself is free, an “unlimited access subscription” offers all the app’s features and content, for either $1.99 per month, $0.83 per month if you pay for a year upfront, or $19.99 for life.
Because of this model, Quickshot is getting slammed in the App Store reviews from those who feel like it doesn’t offer enough features to justify this pricing. The app currently has a 2.3-star rating (out of 5). This, unfortunately, speaks to a larger problem with the App Store’s business model – developers who believe their work is worth paying for are penalized because there are so many free alternatives available they have to compete against, and because the App Store has propagated the belief that because apps are small, they should cost less than desktop software.
Lightricks, before the shift to subscriptions, sold a healthy 11 million paid downloads of its apps. But despite the pushback from users about subscriptions, the company claims they’ve enabled it to increase revenues.
“Regarding the pivot to subscription model we can definitely confirm that there has a been a significant uptick in revenue run rates,” says Itai Tsiddon, Lightricks co-founder. “However, at this time, we are not yet disclosing specific numbers,” he says, adding that the company will release more details around the end of year.",2017-09-05,1536148,https://tctechcrunch2011.files.wordpress.com/2017/09/quickshot-ios.jpg?w=738,startups/,"photography,photos,apps,lightricks","Facetune maker’s latest app, Quickshot, helps you take better photos",,https://techcrunch.com/2017/09/05/facetune-makers-latest-app-quickshot-helps-you-take-better-photos/
Darrell Etherington,Fundings & Exits,"Sony is investing in Acutronic Robotics‘ Series A round, via its Sony Innovation Fund. Sony will also adopt Acutronic’s Hardware Robot Operating System (H-ROS), for use in its own robotics division, the company says. This funding follows investment by DARPA in Acutronic’s platform, which aims to become an industry standard for robotics components from across hardware and software providers.
Acutronic was set up in 2016, and offers a way to allow components combine in new robotics systems easily with ready-made compliance with industry and commercial standards for easy deployment. The idea is to take out some of the more complicated base level steps towards deploying robotics in industry and the workplace, with a focus on building robots that are both reusable across applications and reconfigurable to suit different purposes.
The size of the Sony investment, or Acutronic’s Series A round was not disclosed. But Sony’s strategic use of the platform in its own operations, and DARPA’s prior investment, suggest there’s a lot of interest in this solution for unifying a fractured robotics landscape.",2017-09-05,1536057,https://tctechcrunch2011.files.wordpress.com/2017/09/h-ros-acutronic.jpg?w=738,startups/,sony,Sony backs Acutronic Robotics’ hardware robot operating system,,https://techcrunch.com/2017/09/05/sony-backs-acutronic-robotics-hardware-robot-operating-system/
Ron Miller,Enterprise,"Used to be when we thought about identity as it relates to computers and software, it involved a person logging into an application or service. Increasingly though, you also have machines and sensors attempting to authenticate as they access your systems.
That creates complications for identity management vendors because instead of managing thousands or tens of thousands of identities, it could require scaling to millions or even hundreds of millions logons. ForgeRock, a seven year old identity startup says it has built an identity platform with those kinds of scale requirements in mind.
The approach appears to be resonating with investors. Today, the company announced an $88 million Series D investment round led by Accel with participation from KKR, Meritech Capital Partners and Foundation Capital. Today’s investment brings the total to more than $140 million raised to-date.
CEO Mike Ellis sees his company’s approach to identity as a natural extension of what’s happening the industry. “The relationships between humans, devices, things and services is driving security,” he says. He believes it’s also driving new applications for identity and new business opportunities.
It’s something the company has been building towards from the earliest days, a platform than can scale to deal with identity from a variety of sources beyond just human users. “We believe you have to exist everywhere — at the device and gateway level like a connected car, but also on prem and in cloud,” he said.
Ellis admits that his company has flown under the radar compared with better-known identity companies like Ping Identity, which was sold last year for $600 million to Vista Equity and Okta, which went public in May. But he says the timing of the big round is not a coincidence.
He firmly believes as tech makes the shift to machine-to-machine and sensor-to-machine communications in massive numbers, it’s going to require a new kind of identity platform to deal with the volume that will entail. He also not surprisingly sees his company well positioned to take advantage of that shift.
He’s so confident in fact, he says that today’s investment is the first step toward an IPO. That tends to be information that startup CEOs keep close to the vest, but he is not bashful about saying that is his goal. He sees an IPO, not only bringing the next infusion of cash whenever it happens, but also giving the brand a push in the marketplace that only going public can bring.
The company has been doing well to this point with over $100 million in sales in FY2016. It currently has around 400 employees, but intends to add another 100-150 by the end of the year with the new capital. There are also plans to expand the product offering.
ForgeRock currently has about half of its customers inside the US with half outside, but it intends to continue international expansion with some special attention to China in the coming year, Ellis said.",2017-09-05,1535777,https://tctechcrunch2011.files.wordpress.com/2017/09/gettyimages-661551230.jpg?w=738,startups/,"authentication,iot,identity-management,forgerock",Identity management startup ForgeRock snags $88 million Series D,,https://techcrunch.com/2017/09/05/identity-startup-forgerock-lands-88-million-series-d-investment/
Steve O'Hear,Europe,"Aifloo, a Swedish startup that combines hardware sensors and AI to offer a ‘smart wristband’ to help care for the elderly, has raised €5.1 million in new funding.
The Series A round is led by EQT Ventures, with the VC firm’s Analytics Partner, Henrik Landgren, citing the team and technology as reasons to invest, noting that the e-health company is marrying “vast amounts of data and modern AI” to help elderly people remain living independently for longer.
Founded by Felix Etzler, Michael Collaros and Anders Widgren in 2015, Aifloo is described as an e-health system designed to improve the quality of life for the elderly and provide peace of mind for relatives and caregivers.
The hardware is a wristband packed full of sensors and the AI monitors the wearer’s behaviour so as to alert caregivers of any potentials issues. These are cited as things like trips or falls, alterations in eating habits, and changes in sleep behaviour.
“Aifloo is a completely new e-health system that continually learns about an individual’s behavior – detecting if something is wrong,” explains Etzler. “We help seniors to keep going strong, give peace of mind to family and friends and augment the care delivered by professional caregivers”.
The idea, says the Aifloo founder, is to “digitalize detection of human behaviour in a non-intrusive way”. Specifically, the Aifloo wristband is conceived as a discreet wearable with a long battery life, whilst the real-time cloud AI-analysis does the heavy lifting.
“The service measures trends over time, detects emergencies and alerts people of a problem even if you’re unable to,” he says. “We hope to help carers deliver the right care, at the right time, to those who need it the most, with a little help from technology”.
That, argues Etzler, is very different to the status quo in which the systems used in care are outdated. “A lot of resource goes into manual surveillance,” he says, while more modern solutions are “expensive, not customisable to the individual, or complicated”.
“On the other hand, wearables are targeting the young and healthy or focused on one medical condition, such as diabetes. We’ve created an individualized, durable, easy to use, long-lived solution to a complex problem and packaged it in a nice, wearer friendly product and service”.
To that end, an early customer of Aifloo is Aleris, one of the leading healthcare companies in Scandinavia. Etzler says the next step is begin marketing the service to in-home care companies.",2017-09-05,1535299,https://tctechcrunch2011.files.wordpress.com/2017/09/aifloobandmancoffee-high-1.jpg?w=738,startups/,eqt-ventures,"Aifloo, a Swedish startup that sells a ‘smart wristband’ to help care for the elderly, raises €5.1M",,https://techcrunch.com/2017/09/05/aifloo/
Matthew Lynley,Enterprise,"GetAccept co-founder Mathias Thulin is very familiar with a common problem sales representatives have: they have a great meeting with a potential customer, fire off an email to follow up on that deal and send a thank you note, and then hear nothing back.
With all these leads going dark, Thulin and his co-founder Samir Smajic wanted to dig into the data to figure out what was happening. To do that, they decided to start GetAccept, an e-signature service that helps representatives track their documents and help close those deals. The start-up today said that it has raised $1.6 million in a seed funding round from Amino Capital and Y Combinator, as well as other angel investors. GetAccept came out of Y Combinator in 2016.
“Too many times you had a great meeting that you just said, ah I love this, send me a proposal and I will talk with my manager and get back to you next week,” Thulin said. “Then, they just go dark. There are much more decision-makers involved that they tell you about, and also that it’s so hard to understand how engaged they actually are. You don’t know what’s happening after you sent the proposal. It’s so easy to ignore your inbox and phone when you try to follow-up with a sales rep.”
Internally, GetAccept analyses a sales representative’s behavior to see why they are closing on more deals, or vice versa. It looks for cues, like a sales representative including a product demo or the company connecting directly through a chat bot that then connects them directly to another representative. These sales representatives can also lean on retargeting, chasing their leads across platforms in order to build that awareness. Thulin argues that it’s all these light touches that can help companies close that deal, but often times they just go overlooked.

He also likes to say that his startup is based on artificial intelligence — though you won’t find it at the deep, complex level of a convolutional neural network. But there is certainly some learning happening in the background, with algorithms studying the behavior of the best sales people and the trick and quirks they have that are helping them close better sales leads. It’s not some kind of hardcore AI that would come out of a lab at Stanford, but this kind of self-reflecting software is a hallmark of many emerging enterprise sales startups that look to help businesses streamline their processes.
“If we could find the triggers that could help push the deal forward, we would do it,” Smajic said. “We see that it’s really for different reasons why sales reps can push the lead forward. If [potential customers] don’t open the document in 24 hours, then we definitely need to address it. We also see another case that if they forward it to other people [in the organization] that the deal will be postponed because there are people involved. We figured out we couldn’t use generic tools, and that was the reason.”
GetAccept, with this seed funding, still faces an uphill battle against e-signature companies like DocuSign and lead tracking from existing lead-tracking CRM start-ups like Gong or Attach. Those are two very significant markets, though Smajic says that by targeting a product that does both of them will help them outmaneuver the companies that look to eventually dig into each others’ territories. Getting there first will help, though it remains to be seen if they will be able to get the kind of widespread adoption that these companies have already built up.",2017-09-04,1535201,https://tctechcrunch2011.files.wordpress.com/2017/09/founders_20171.jpg?w=738,startups/,,GetAccept raises $1.6M to help companies close sales leads faster,y-combinator,https://techcrunch.com/2017/09/04/getaccept-raises-1-6m-to-help-companies-close-sales-leads-faster/
Steve O'Hear,Europe,"Habito, a London startup that is bringing the entire mortgage process online, has raised £18.5 million in Series B funding. Atomico, the European VC firm founded by Skype’s Niklas Zennström, led the round, with participation from existing investors Ribbit Capital, Mosaic Ventures, and Revolutionary (Ad)Ventures. It brings the total raised by the U.K. company to just over £27 million.
More interestingly, Habito, which probably counts Trussle as its closest direct competitor, says the new capital will in part be used to integrate its technology with major retail banks and high street lenders to facilitate “real-time mortgage approvals”, in addition to marketing and other product development. The startup says it also plans to expand its offering to other parts of the mortgage process, namely home and life insurance.
Calling itself a “digital mortgage broker,” Habito was founded by Daniel Hegarty, who was previously an early employee at Wonga, to remove a lot of the friction when applying for a mortgage. The company’s tech claims to analyse over 11,000 mortgage products across 70
lenders in real-time, to help identify the most suitable mortgage based on your individual circumstances. The entire application process can then be completed via the Habito app/website for free, thus eliminating the fees that most traditional mortgage brokers charge.
There is, however, an additional aspect to the Habito premise, and one that has the potential to be quite disruptive beyond pricing. Once you’ve signed up to the app and entered all of the required details related to your eligibility and your current mortgage and property (if you have one), the startup will effectively become your broker going forward.
This sees its tech continually monitor the mortgage products available on the market and alert you if it thinks you have become mismatched and therefore are paying over the odds. The idea is to make switching also as frictionless as possible. That’s because, says Habito, 1 in 4 British homeowners are currently mismatched, paying lenders an average of around £4,000 more than they need to every year.
“Fintech companies are tackling a lot of traditional areas that are ready for a new approach. This is one of them,” Atomico Partner Niall Wass tells TechCrunch. “Matching borrowers and lenders in the residential mortgage space is slow, expensive and very fragmented – with around 15,000 largely offline brokers in the U.K. But the potential is not just in the U.K., it’s across multiple markets with the same problem.”
However, despite describing the Habito value proposition for both borrowers and lenders as being pretty clear, Wass says one challenge the startup faces is the degree of apathy by house owners when it comes to remortgaging.
“This apathy is why there is such massive overspend in this market globally – perhaps because the process to move to a better mortgage has been so slow and complicated. So the first challenge is continuing to make the process simple, speedy, free and with a better outcome for the borrower. This is absolutely key,” he says.
“I love the idea that Habito has your back and will check the market automatically for a better deal for you – but that kind of message has to get out, so the next challenge is to help build the brand”.
In addition, the Atomico VC says that Habito will need to further prove the benefits to lenders too by using more technology to make it easier and cheaper to “assess the customer risk and matching them to the most appropriate product”. Hence plans to integrate with major retail banks and high street lenders at the technology level.",2017-09-03,1535517,https://tctechcrunch2011.files.wordpress.com/2017/09/habito-press-image-2.jpg?w=738,startups/,"atomico,trussle","Habito, an app that helps you find the right mortgage, raises £18.5M Series B led by Atomico",,https://techcrunch.com/2017/09/03/habito-atomico/
Joanna Glasner,Health,"

The connected life is not necessarily the good life. Too often, it seems like we are squandering our time checking devices, losing touch with fellow humans and cultivating bad habits in the pursuit of instant gratification.
If only an app could fix that. Preferably, it’d be one we could use all day long and did not require interacting with humans. It’d be nice to download in a couple of minutes, too.
Welcome to the world of mindfulness and wellness apps. In the past year or so, investors have backed more than 20 startups developing apps and tools aimed at promoting mindfulness, happiness and other desirable mental states. To date, these companies have raised more than $150 million, according to Crunchbase data. Several of the largest rounds have been in recent months, with the vast majority of funding going to California-based startups.
Take a deep breath, and we’ll take a deeper dive into where all that money is going.
So far, the largest funding recipient is Headspace, developer of a popular app for learning meditation techniques. The Santa Monica-based company, which closed a $37 million round in June, has raised $75 million to date. It’s a fairly straightforward business model: users start with a few free lessons and subscribe if they want to keep going.
Headspace bills itself as the world’s most popular meditation app, with more than 18 million downloads. Its mission, however, is much broader.
“Meditation is just the first act,” says Ross Hoffman, Headspace’s chief business officer. Over time, the seven-year-old startup wants to build “the most comprehensive guide to health and happiness from when you’re born to when you die and everything in between.”
It’s in expansion mode, too, committed to what might be called happy scaling. The careers page features images of an open office space complete with sweater-knit upholstered sofas and blissful staffers nibbling salad and steamed rice. Job applicants are asked to explain how they see their role impacting the company vision of improving the health and happiness of the world.
There are also other well-funded startups in the space dedicated to making us feel better. Happify Health, a developer of digital tools and programs it says are “designed to motivate individuals to address the full range of their emotional needs,” has raised $25 million. And Grokker, a provider of online yoga, meditation and fitness lessons, brought in $22 million.
There are lots of other interesting-sounding companies that have raised seed and early-stage funding. The list includes Calm, a Headspace rival, Shine, an app that sends motivational text messages and Thrive Global, which wants to help busy people avoid burnout.
Initial snarkiness aside, apps geared to more balanced living do appear to fill a niche in our over-connected lives. Moreover, while there may be some irony in using devices to cure the ills of digital overstimulation, there’s also some logic.
“Technology has been the bridge that makes us more aware of everything on the planet… But it also causes us to be the multi-taskers we are and to have thousands of friends but to be lonely,” says Stuart Rudick, founding partner at Mindful Investors, a socially conscious micro VC fund. Mindful’s portfolio includes Muse, developer of a brain-sensing headband that guides wearers through meditation using changing weather sounds.
Rudick sees investor interest in mindfulness and meditation tools as an extension of the broader healthy living sector. Meditation, in particular, appears to be following a similar trajectory to that of yoga a decade or so earlier and is becoming popular with a much broader segment of the population.
From an investor perspective, yoga, fitness and healthy living deals have produced some nice returns and high valuation companies, too. Yoga apparel maker Lululemon, a former venture-backed startup that went public 10 years ago, is currently valued around $8 billion. In the unicorn space, Peloton, the company behind the spinning craze, closed its last round at a $1.25 billion valuation. (We’ve aggregated a few others here.)
There have been disappointments, as well. A recent case in point is YogaWorks, a private equity-backed yoga studio chain that has seen its stock price cut by nearly a third since its August IPO, which already debuted below the initial projected price.
Yet investors in the mindfulness space typically aren’t looking for just financial returns. Many, like Rudick, are so-called double bottom line investors, who look for companies that provide some social benefit in addition to profit potential.
Meditation and mindfulness practices are also popular in celebrity circles, which seems to have helped startups in the space secure funding from famous backers. Headspace’s investor lineup includes Ryan Seacrest, Jessica Alba and Jared Leto. Muse counts Ashton Kutcher as a backer. Thrive, meanwhile, is founded by well-known media entrepreneur Arianna Huffington.
Now, celebrity support won’t turn a laggard into a unicorn. But given how much time we spend with our devices binging on celebrity-studded content, perhaps we’d be wise to listen when these same celebrities gently suggest we take a few minutes to clear our minds.
iStockPhoto / Martin Dimitrov",2017-09-02,1535315,https://tctechcrunch2011.files.wordpress.com/2017/09/istock-639794882-1024x683.jpg?w=738,startups/,"headspace,thrive,calm",Funding your bliss: mindfulness startups scale up,,https://techcrunch.com/2017/09/02/funding-your-bliss-mindfulness-startups-scale-up/
