authors,category,content,date,id,img_src,section,tags,title,topics,url
Natasha Lomas,Artificial Intelligence,"Libratone, a Danish maker of snazzy high end wireless speakers, has announced its existing Zipp and Zipp Mini speakers will get support for Amazon’s Alexa voice assistant via a free app update, slated to arrive this fall.
This means existing owners of the speakers will be able to jump aboard the smart speaker craze — and use their Libratone Zipps like an Amazon Echo and ask Alexa to do stuff like look up sports scores, tell a joke, provide a weather update or indeed order something from Amazon.com.
Although — unlike Amazon’s Echo speakers — the Libratone Zipps do not have built-in microphones that are persistently listening for a trigger word.
The company confirmed that users wanting to talk to Alexa will therefore have to manually touch a button on the top of the speaker to do so. So while the quality of Libratone’s audio is more premium than Amazon’s Echo speaker hardware, its existing microphones (previously used to support a conference call functionality) aren’t as tuned for this use-case — ergo there will be more friction between you and Alexa’s ‘lazy web’ answers to your voice commands.
(Or more privacy safeguards between you and Amazon’s data-harvesting AI, depending on your perspective.)
Rival speaker maker Sonos had already been expected to unveil its own voice play on October 4. And according to an FCC filing, Sonos intends to introduce support for multiple voice assistants to existing speaker hardware.
But Libratone’s opening gambit here is to start with just Amazon’s Alexa as its chosen partner for ‘smartifying’ its premium hardware.
Asked why it’s adding Alexa Libratone’s president, Mike Culver, told TechCrunch it had noticed some customers already using their Zipps with Amazon’s entry level Echo Dot device — so seeking to control their Zipp via Alexa voice commands sent to the ever-listening Dot.
“We started investigating additional integrations that would make sense based on the consumer demand — for the Amazon Alexa capabilities, but available in a much better quality sounding speaker, which is why they’re purchasing Zipp and Zipp Mini and pairing it with the Echo Dot,” he said. “That was the stimulus.”
“Then when we looked at the bigger picture we fundamentally believe that one of the key interfaces, from a usability standpoint for our speakers, should evolve to include voice. It’s a natural way to interact with our speakers and with music. And we believe the speaker also serves as a natural integration point to the smart home.
“So both of these led us to integrate with Amazon,” he added.
What happens if a customer does not want their speaker to be turned into an Amazon-enabled listening outpost? Culver said that while the user does not have a choice to decline the firmware update, they would need to take additional steps to actually enable and activate Alexa. And thus could choose not to.
“After the Libratone Zipp or Zipp Mini speaker have the firmware update for Amazon Voice Services, the user will need to use the Libratone App to enable and configure it,” he confirmed. “The Libratone App will include a step that will take you to the Alexa App (and require you to download it if you do not already have it), where you will register the Zipp/Mini speaker for use with Amazon Voice Services.  Afterward, you will be passed back to the Libratone App for final confirmation.” 
Culver also noted that as part of the Alexa App registration a user would have to accept Amazon’s privacy policy, since they will be using Amazon’s voice services. Though, again, Zipp owners not wanting to agree to their personal data being processed by the ecommerce giant can do so by avoiding registering for the Alexa app.
“All of our updates require the customer to authorize the update to the speaker… And once they update — and we’re always doing updates so eventually all the speakers will have this capability — they still have to configure it for it to start working,” added Culver, further emphasizing that even users who do configure Alexa still have to manually touch a button on the top of the speaker and say the word “Alexa” to summon the AI.
Therefore, he said, Libratone will not be updating its own privacy policy ahead of this impending update as it does not believe it needs to.
“That’s the difference between farfield microphones, that are just continuously listening, vs the way we’ve implemented it — which is based on the use-case that the customer has to intentionally want to do this. They have to touch the bird [logo on the button on top of the speaker] and at the same time give the Alexa voice command,” he added.
“We are planning to add the possibility to disable [the Alexa integration] from within the Libratone App if customers wish to do so,” he also noted.
Culver would not comment on whether Libratone is planning to launch any new speaker models in future with the Alexa AI baked in from the get-go plus microphone hardware that is always listening.
“This is what we think is a really good first step,” he added. “And we’re always studying voice as a user interface — and I think all the questions that you’re asking are the same ones that we’re continually asking ourselves… so we’ll see how this [space] evolves both in implementation as well as with other competing voice services in the future.”
In another integration twist, Amazon and Microsoft yesterday announced a forthcoming tie-up will enable users of Alexa to summon Microsoft’s Cortana voice assistant, and vice versa. So, in future, it may end up that enabling one voice assistant means being able to get in touch with any of them — at least, that’s Jeff Bezos’ prediction.
In the meanwhile, Libratone owners enabling the Alexa integration can certainly look forward to being able to ask the AI to summon Cortana too — if they really want to use their speaker to update their calendar or check something in Outlook.
For now it looks like the immediate future of voice interfaces will be voice assistants nested within voice assistants — in an attempt to make the technology more useful. Let’s just hope all these various vocal summons don’t result in cacophonous confusion of AI assistance.
What’s the collective noun for a group of voice AIs? With ‘echo’ already taken directly, we’ll have to pencil in ‘nest’ (sorry, Google!) as the working word for that.",2017-08-31,1534120,https://tctechcrunch2011.files.wordpress.com/2017/08/libratone-black-06-closeup-2-hr.jpg?w=738,europe/,"zipp,amazon-com,libratone,smart-speakers",Libratone update will add Amazon Alexa voice control to its speakers,,https://techcrunch.com/2017/08/31/libratone-update-will-add-alexa-voice-control-to-its-speakers/
Natasha Lomas,eCommerce,"Google has submitted details to the European Commission of how it intends to amend its price comparison service, Google Shopping, to comply with an antitrust decision earlier this summer. The proposals were submitted yesterday.
A spokesperson for the Commission confirmed it had received information from Google pertaining to complying with the ruling.
The company has until the end of September to end its censured conduct or risk a regime of additional daily fines that would be backdated to the date of non-compliance.
The Commission has not published Google’s proposals for complying with the ruling — and TechCrunch understands there is no official intention to make the proposals public.
“It is Google’s sole responsibility to ensure compliance with the Commission antitrust decision. The Commission’s role is to monitor Google’s compliance. In this context the Commission can confirm that, as required by the Commission decision, it has received information from Google on how the company intends to ensure compliance with the Commission decision by the set deadline. Furthermore, Google will continue to be under an obligation to keep the Commission informed of its actions by submitting periodic reports,” the EC spokesperson told us.
“The Commission decision requires Google to stop its illegal conduct within 90 days of the decision and refrain from any measure that has the same or an equivalent object or effect. In particular, the Commission decision sets out the principle that Google has to give equal treatment to rival comparison shopping services and its own service.”
Back in June Europe’s Competition Commission issued Google with a record-breaking €2.42 billion (~$2.73BN) fine for antitrust violations pertaining to Google Shopping.
Its finding was that Google had demoted rival comparison search services in organic search results, while at the same time as giving systematically prominent placement to its own comparison shopping services.
The fine was the culmination of more than six years of investigation by the European Commission into Google’s search practices — although a formal Statement of Objections was not issued until April 2015.
The company’s search engine holds a hugely dominant marketshare of the European market (circa 90 per cent) — and the Commission additionally deemed Google to be a dominant company in Internet search; a finding which will feed into additional EU antitrust investigations into its behavior.
Google was given 90 days to cease the censured conduct pertaining to Google Shopping or face additional penalty payments of up to 5 per cent of the average daily worldwide turnover of Alphabet, its parent company, for each day of non-compliance.
And while Google initially suggested it might be considering an appeal, it appears the company has decided compliance is the safer option.
A spokeswoman for the company declined to comment when reached for comment but confirmed it has informed the Commission of its planned remedies to comply with their decision.
ICOMP, an ecommerce lobby group formed of Google rivals, has called for the publication of both Google’s proposed remedy and the full Commission decision — which has yet to be put online, although competition commissioner, Margrethe Vestager, said in June it would publish the decision in full (minus any commercially necessary redactions).
In a statement yesterday, ICOMP’s chairman Michael Weber said: “ICOMP calls for publication of the full commission decision and Google’s remedy proposals so that we and the public generally can compare the proposals (if any) with the Commission’s assessment of Google’s wrongdoing. These affect everyone in the online and mobile worlds, so they must be made public for evaluation.”
The EC has additional ongoing antitrust investigations into other areas of Google’s business, including its Android mobile operating system and AdSense advertising-related practices.
In June, Vestager said the EC’s preliminary conclusions in relation to both practices is that they also breach EU antitrust rules — though she also emphasized the investigations remain ongoing.",2017-08-30,1533459,https://tctechcrunch2011.files.wordpress.com/2016/05/524861120.jpg?w=738,europe/,"european-commission,shopping,online-advertising",Google takes steps to comply with EC antitrust order for Google Shopping,google,https://techcrunch.com/2017/08/30/google-takes-steps-to-comply-with-ec-antitrust-order-for-google-shopping/
Steve O'Hear,Europe,"There seems to be no end to the number of startups operating in the travel and accommodation space. These range from online travel agencies, hotel booking sites and aggregators, to companies that help hotels fight back in an attempt to get more direct bookings. And of course there is Airbnb and its ilk.
One growing sector we can add to the travel accommodation list is long term stays for business travelers. Enter Cologne-based Homelike, founded in 2015 by Dustin Figge and Christoph Kasper. The German startup targets business travelers who need “long-stay” accommodation of a month or more and for which a hotel doesn’t really cut it. Citing growing demand from both the supply and demand side, the startup has just raised €4 million in Series A funding led by Cherry Ventures, with participation from existing backer Coparion.
“Due to many international work assignments, Christoph and I used to work and live abroad for several months with stays in China, the U.S, and some European cities. Eventually we were both tired of staying in hotels with limited privacy and without a ‘home away from home’ feeling,” explains Figge, Homelike’s CEO.
“Furnished apartments were more comfortable, flexible and also significantly cheaper than hotel rooms. We both liked it way more than hotels! However, it was anything but easy to find a suitable apartment and book it online from a remote location. That was the point, the idea for Homelike, and thus our business was born”.
As the pair began to scope out the startup’s product, Figge says it became more evident how underserved business travel is within the apartment rental market. At the same time, companies increasingly require employees to relocate temporarily as part of their work for weeks if not months on end.
“Also companies themselves are trying to cut accommodation costs rapidly these days,” he adds. “They spend about 25 per cent of their business travel costs on overnight stays. When it comes to prolonged periods, furnished apartments are, in most cases, a 40 per cent more cost-effective solution in comparison to hotels. Including added benefits of being more comfortable and flexible. Simultaneously, the temporary housing market is growing rapidly by 20 per cent year over year and is becoming much more professional”.
To take advantage — and feed — this trend, Homelike offers an entirely online and “no friction” booking experience for furnished apartments for long stays. This includes a secure booking process, corporate travel policies (such as VAT invoicing), and a user experience it says is designed to cater to the needs of corporates.
Furthermore, Figge says that apartment providers prefer Homelike because they can easily list their entire inventory online. “After the apartments have been verified based on our quality standards, the landlord can relax knowing that we take care of the whole process end-to-end, including the billing and transactional process. We are the only platform which provides a digital rental agreement that is signed by both parties, skipping the traditional process of printing and sending a paper copy back and forth,” he explains.
More broadly — and something that likely attracted Cherry — is that the rental market is generally shifting towards the direction of furnished and serviced living. “Similar to the shifts we are experiencing in transport and mobility, we believe that the rental market will develop towards a ‘living-as-a-service model’,” says Figge.
Finally, I’m told there is another piece to the Homelike play: data. This is seeing the startup generate what it claims to be a significant amount of data around rental prices, the best locations, the best floor plans, etc — data it reckons will enable Homelike to vertically integrate further with developers that are building new and proprietary supply that is tailored to the business travel segment.",2017-08-30,1533077,https://tctechcrunch2011.files.wordpress.com/2017/08/homelike_founders1.jpg?w=738,europe/,cherry-ventures,"Homelike, a German startup that lets business travelers find an apartment, picks up €4M Series A",,https://techcrunch.com/2017/08/30/homelike/
Darrell Etherington,Asia,"Another major automaker is setting up a dedicated joint venture to build EVs for the growing demand in China, joining Ford and Volkswagen: This time, it’s Nissan-Renault, which will work with China’s Dongfeng Motor, an automaker it partnered with last year to open its first factory in China.
Automakers from outside China basically need a local dancing partner in order to make and sell vehicles in the country, without incurring huge import taxes that would basically render their operations unsustainable. Previously, automakers were limited to setting up two joint ventures with Chinese partners to produce cars in-country, but Beijing has allowed the creation of a third joint venture – provided it’s dedicated entirely to EVs.
Renault-Nissan’s new partnership with Dongfeng is called eGT New Energy Automotive Company, and it’ll be split between Nissan with 25 percent ownership, Renault with another 25, and Dongfeng with the remaining 50, according to Reuters. The first vehicle from the JV will be a new electric vehicle based on one of Renault-Nissan’s subcompact crossover SUV platform designs.
Automakers are racing to build out their EV construction and sales capacity in China thanks to strong incentives put in place by the Chinese government for the market. China is also enforcing strict quotas on overall vehicle sales, requiring that a full 8 percent of any automaker sales in the country be either pure electric or plug-in hybrid by 2018, with incremental increases in that percentage every year after that.
This could end up helping with electrification abroad, too, since it’ll help automakers reconfigure their operations to focus on developing EV tech and electric-specific vehicle designs.",2017-08-29,1532881,https://tctechcrunch2011.files.wordpress.com/2017/08/gettyimages-508080342.jpg?w=738,asia/,"dongfeng-motor,renault-nissan",Renault-Nissan and Dongfeng partner to build electric cars for China,,https://techcrunch.com/2017/08/29/renault-nissan-and-dongfeng-partner-to-build-electric-cars-for-china/
Catherine Shu,Asia,"China’s crackdown on Internet freedom is getting even more intense. Last Friday, the country’s top Internet censor announced a new set of regulations (link via Google Translate) meant to eliminate posts by anonymous users on Internet forums and other platforms. The Cyberspace Administration of China will start enforcing those rules on Oct. 1.
According to the new regulations, Internet companies and service providers are responsible for requesting and verifying real names from users when they register and must immediately report illegal content to the authorities. Tech firms, including Baidu, Alibaba and Tencent, are under more pressure to serve as the government’s gatekeepers as China prepares for the 19th National Congress of the Communist Party this fall, which is expected to place new people in several key leadership positions.
Furthermore, a new cybersecurity law that went into effect at the beginning of June requires tech companies to store important data on servers within China. While this is supposedly meant to protect sensitive information, it can also make it easier for the government to track and persecute Internet users.
Along with announcing its new regulations about anonymous posts on Friday, the CAC also specified what content is forbidden from being published online (link and translation via Google Translate), citing a passage from a bill that was passed in 2000 to regulate Internet information services in China. The list is so broad that it can cover almost anything:
While China has issued various rules requiring online real-name registration for years, the CAC’s new regulations are another sign that the government is becoming increasingly stringent about censorship. For example, using VPNs to access blocked sites like Facebook and Twitter was relatively easy until earlier this year when the government began a crackdown that many observers believe is much more serious than previous attempts to enforce the ban.
As The Diplomat notes, China is taking a multi-pronged approach as it doubles down on censorship, placing more pressure on international publishers as well.",2017-08-27,1532129,https://tctechcrunch2011.files.wordpress.com/2017/08/gettyimages-72054208.jpg?w=738,asia/,"real-name-registration,censorship,china","China doubles down on real-name registration laws, forbidding anonymous online posts",,https://techcrunch.com/2017/08/27/china-doubles-down-on-real-name-registration-laws-forbidding-anonymous-online-posts/
Jon Russell,Asia,"Go-Jek, the on-demand transportation company that rivals Uber and Grab in Indonesia, is getting close to pulling in its next huge funding round.
That’s because JD.com, the China-based e-commerce firm that rivals Alibaba, has agreed to join Go-Jek’s upcoming $1.2 billion round, a source with knowledge of discussions told TechCrunch. The news was first reported by The Information.
We reported on the upcoming round, which would value Go-Jek at $3 billion post-money, in May when sources told us that Tencent had formally agreed to lead the deal. It looks like it has taken slightly longer to pull things together than was anticipated at the time, but the addition of JD.com — a long-term Tencent partner, which is reportedly putting $100 million in — it is close to being finalized.
Go-Jek previously raised $550 million at a $1.3 billion valuation in August 2016. It counts PE firms KKR and Warburg Pincus, and VCs Sequoia Capital, Northstar Group, DST Global and NSI Ventures among its backers.
Founded in 2010, Go-Jek began as a motorbike taxi on-demand service but it has since expanded to cover four wheels and offer services like grocery delivery, massages and more. The company most recently claimed to have over 200,000 drivers across some 25 cities in Indonesia, which remains the only market where it is active — although it does have a sizable development team located in India.
Go-Jek is also making a big push for its digital payment service, which it hopes can go beyond merely paying for rides and help build engagement and loyalty with customers to help it battle Uber and Grab. In that respect, the addition of Tencent — which has turned WeChat into a huge chat app with a strong mobile payment business, too — and JD.com could massively help.
Rival Grab, which recently raised $2 billion, is putting huge emphasis on Indonesia, where it is pushing its own digital payment service and making acquisitions to further it.
Aside from being Southeast Asia’s largest economy and population — Indonesia is home to over 250 million people — the country is tipped to be the region’s largest internet economy by some margin.
Southeast Asia’s ride-sharing market is predicted to grow from $2.5 billion in 2015 to $13 billion by 2025, according to a report co-authored by Google. Indonesia’s share of that segment is forecast to jump from an estimated $0.8 billion to $5.6 billion over that same period.",2017-08-25,1531461,https://tctechcrunch2011.files.wordpress.com/2017/08/go-jek.jpg?w=738,asia/,"economy,car-sharing,business,transport",Indonesian Uber rival Go-Jek closes in on new $1.2 billion round,,https://techcrunch.com/2017/08/25/go-jek-jd-com-tencent/
Jon Russell,Asia,"Samsung vice chairman and the company’s heir apparent Jay Y. Lee is headed to jail after a court in Korea ruled that he is guilty of bribery, embezzlement, capital flight and perjury charges.
Lee, who has been earmarked as the future leader of the company, was handed a five-year jail sentence, although he is expected to appeal the decision. He took a board seat at Samsung last year in a move that symbolized his ascension and the expectation that Lee would replace his father Lee Kun-Hee, who has been hospitalized for over two years since suffering a heart attack while at the helm of the corporation.
This verdict, which comes just days after Samsung launched its impressive new Galaxy Note 8 flagship phone, obviously throws Lee’s future at the company into question.
The executive was arrested in February when he was accused of paying bribes to an advisor of former President Park Geun-hye in exchange for political favors.
The New York Times reported that he is alleged to have given a total of $36 million to Park’s secret advisor in order to win government support for a merger between two Samsung subsidiaries. Park, Korea’s first female leader, was impeached and removed from office due to the influence of her aides.",2017-08-24,1531417,https://tctechcrunch2011.files.wordpress.com/2017/08/lee-jae-yong-samsung.jpg?w=738,asia/,"business,manufacturing",Samsung heir handed 5-year jail sentence for bribery,samsung,https://techcrunch.com/2017/08/24/samsung-heir-handed-5-year-jail-sentence-for-bribery/
