authors,category,content,date,id,img_src,section,tags,title,topics,url
Romain Dillet,Europe,"French startup Linxo just raised $24 million (€20 million) from three financial institutions — Crédit Agricole, Crédit Mutuel Arkéa and MAIF. The company is building a sort of Mint for the French market.
Banking apps suck in France. Most of them are just a wrapper around a mobile website. It takes them years to adopt new features, such as fingerprint readers, widgets and more.
And many people have more than one bank account. It becomes quite tedious to check your balance and transactions on all your accounts as you have to deal with multiple shitty apps.
Linxo is trying to solve that by building an above average app and service that connects to all your bank accounts. The startup supports dozens of French banks. At first, you need to give Linxo your bank account login information. The company’s servers will then periodically sync past transactions.
This way, you get a good overview of all your bank accounts in one app. You can see past transactions and charts about money you’re spending. It’s a good way to get insights about your financial situation.
But the company plans to go one step further and build a full-fledged financial hub. Its competitor Bankin has already introduced a way to transfer money between accounts in different banks. This feature is currently limited to a handful of banks.
I’m sure Linxo has something similar in mind, as well as ways to save money, get a credit line and buy insurance products. The company has been working on Linxo Connect, a way to sign up to new financial services without leaving the app, using APIs.
With today’s funding round, the startup plans to expand to other European countries. Linxo is also working with French banks to help them with their apps and websites. This could be a lucrative market as well.",2017-09-09,1538050,https://tctechcrunch2011.files.wordpress.com/2016/06/455316308.jpg?w=738,europe/,france-newsletter,Linxo raises $24 million for its app that brings bank accounts together,,https://techcrunch.com/2017/09/09/linxo-raises-24-million-for-its-app-that-brings-bank-accounts-together/
Mike Butcher,Europe,"So much for a smooth launch. Ride-hailing startup Taxify launched this week in London to a big PR-push and fanfare. Most of the coverage was about how this plucky startup was going to take on the Uber giant. But Taxify has now had to pause its operations in London after a transport union questioned if it had a license to operate, and official body Transport for London announced it would investigate Taxify’s operations. Meanwhile, the startup has been tweeting drivers that download and use its app not to say they are “employed by Taxify.”
So what is going on?
(UPDATE: Taxify has now issued a statement saying it has “done everything in its power to comply with the local regulations, but is faced by aggression from TfL.” It says that running Taxify as a technology platform directing bookings to City Drive Services registered drivers is “completely compliant within the existing UK law, and is a common practice.” TfL has revoked the license held by City Drive Services).
A few months ago, Taxify applied for a license to operate a taxi service in London. This is important, because there is a big misunderstanding going on here about what Taxify is: it’s actually fleet management software in the cloud. Cab firms sign up for it, and use it to replace their tired old booking software, while Taxify takes a low fee. In other words, Taxify doesn’t want to run cab or private car firms. It’s basically a tech front for licensed cab firms that could never build and manage such complex software themselves. But to launch in London, it needed a way in.
Well-placed sources say Taxify reached out to TfL in April about launch, but TfL was “walling” the firm, say the sources. Faced with a slow-moving bureaucracy, Taxify went ahead and literally bought a local cab firm, City Drive Services. This has a licence to operate with TfL, trading under two brand names, Avanti Car Service CityDrive and Sigma Car Service.
For Taxify is not just a plucky little startup taking on Uber — it’s now backed by Chinese ride-hailing tech giant Didi Chuxing in China.
Somehow, Taxify thought that just by buying a cab firm with a license, installing its cloud services and apps with the drivers, it could would then have carte blanche to launch its service in London.
Er, no. Taxi regulation doesn’t work like that.
The powerful GMB Union wrote to TfL saying: “The decision to acquire an operator and not advise Transport for London (TfL) of a fundamental change to licensing conditions seems incompatible with the law.” It questioned whether the firm is “fit and proper” to hold a licence with TfL, asking about driver safety, and saying there is “obfuscation” about how Taxify actually works and operates.
They may well have a point.
Taxify is clearly trying to shoe-horn its service into London, not by encouraging local players to sign up for its service, but by literally acquiring a local player and launching. It’s not clear yet whether it had actually outlined this to TfL.
But Founder and CEO Markus Villig says he has spoken to lawyers about the arrangement: “We have literally sent them (TfL) an email every 3 days, so they knew very well we were launching.”
A TfL spokesperson said: “Taxify is not a London licensed private hire operator. We are urgently investigating the nature and extent of its activities and will take action where appropriate.”
Taxify launched in Estonia in 2013 and now operates in 18 countries, mainly emerging markets like Eastern Europe and Africa. The startup claims to have more than 2.5 million customers, and recently announced a strategic partnership with Didi Chuxing in China.
It has an “all-in-one solution for taxi companies.” Basically, a booking system with a consumer-facing app. Traditional taxi companies use Taxify’s web-based dispatcher and fleet management systems to manage their back-end and unite under Taxify’s consumer-facing app to stay competitive against expanding networks like Hailo and Uber. That then lowers Taxify’s costs, allowing them to charge less. It then charges the cab firm a low monthly fee of about €12-15 per driver per month.
Taxify’s other focus is its rapidly growing Local Partner program, which allows entrepreneurs to set up their local Taxify business using a franchise model and become a city manager on a revenue share model.
UPDATE: Taxify has now issued the below statement:",2017-09-08,1537936,https://tctechcrunch2011.files.wordpress.com/2017/08/taxify.png?w=738,europe/,taxify,Taxify’s London launch halted after transport regulator mounts investigation,,https://techcrunch.com/2017/09/08/taxifys-london-launch-halted-after-transport-regulator-mounts-investigation/
Natasha Lomas,Europe,"U.S. consumers hearing the news yesterday of a massive Equifax data breach, which the company revealed potentially affects 143 million consumers, and includes data such as names, addresses, dates of birth, social security numbers, drivers’ licenses and — for a subset of hundreds of thousands — credit card information too, not only had to contemplate the horrendous scale of the thing.
They were also left to grapple with an Equifax ’emergency response line’ that hung up on them, and an Equifax data breach ‘help’ website that appears to raise a lot more questions than it answers — not least the core consideration that it’s requiring desperately worried consumers to trust a company that has failed to protect their personal data with more of their personal data, by inputting it into a web form, just to check whether they might be affected by the breach.
And that’s before you even consider whether Equifax is trying to use the site’s terms of service to get users to waive their rights to bring a class action lawsuit against it — as appears to be the case. Which would be spectacularly unclassy, to say the least.
The cherry on this unlovely layer cake is the fact the credit checking company states it found out about the breach on “July 29 of this year” — while the unauthorized access apparently occurred “from mid-May through July 2017”.
Which means it’s given itself well over a month before deigning to tell consumers their personal data might be in the hands of identity thieves.
That might not seem so bad if you compare it to the current biggest (known) data breaches — affecting at least 500M Yahoo accounts, and more than 1BN Yahoo accounts — which took place years before the company disclosed the intrusions to the public, although it’s not clear when exactly Yahoo itself discovered the breaches.
Even so, 40 days remains an awfully long time for consumers to be kept in the dark about the fact their identities and other highly sensitive personal data might be being traded by hackers, used to compromise other services, and sold to spammers for targeted spearphishing attacks.
Equifax does not explain the length of time it took to inform the public about the breach. And yesterday said it “will” be writing directly to affected individuals, and is “in the process of” contacting state and federal regulators. So, very clearly, the company hasn’t been spending any of the past 40 days warning affected individuals or informing data watchdogs that its systems had been breached.
The US does not currently have a federal law requiring companies to inform the public about data breaches, though one was proposed in 2015 under President Obama which would have set a 30-day notification requirement, but it failed to get support.
And while the vast majority of states have enacted breach notification statutes of their own at this point, and some have stricter notification requirements than the 2015 proposal, others don’t. It’s a patchwork — and therefore a lottery for U.S. consumers.
Over the pond in the European Union the story is different. A single breach notification standard for personal data was agreed at the end of 2015 — and is set to come into force in May 2018, under the incoming GDPR (General Data Protection Regulation).
This will set a data breach notification bar across the bloc of “not later than 72 hours” after a data controller has become aware of an intrusion.
There are some caveats to this portion (Article 33) of the regulation (phrases like “without undue delay and, where feasible”, and some potential for exclusion based on the type of data being breached (“unless the personal data breach is unlikely to result in a risk to the rights and freedoms of natural persons”).
But the expectation is clearly that data controllers must disclose a personal data breach to a national supervisor data authority, at the very least, radically sooner than the ’40 days later’ which Equifax reckons is an acceptable disclosure timeframe.
(While the type of data involved in the Equifax breach is clearly highly sensitive, so this incident would seem a very unlikely candidate for qualifying for a notification exemption under GDPR.)
Another change Europe’s incoming rules are bringing is a big stick to drive compliance for the new breach notification standard, as companies that do not comply with the new rules risk very stiff penalties for failing to do so.
In the case of non-compliance over breach notification, the GDPR gives data watchdogs the power to issue fines of up to €10M (~$12M) — or up to 2% of the total worldwide annual turnover of a company’s preceding financial year, whichever is higher.
In Equifax’s case its 2016 operating revenue was ~$3.145BN. So — under the GDPR regime — the company might have faced a fine of around $62.9M if it hadn’t reported this data breach multiple weeks sooner than it chose to. (Indeed, it’s expecting its full year 2017 revenue to be even higher, between $3.395BN and $3.425BN, so this theoretical fine inflates to as much as $68.5M.)
Which does rather give pause for thought.
If you’re a multinational corporation processing the personal data of EU citizens those sorts of figures probably send some rather large shivers down the CEO’s spine.
Equifax does indeed have a European presence, and has also said that some UK consumers are affected by the breach — writing yesterday that as part of its investigation it “also identified unauthorized access to limited personal information for certain UK and Canadian residents”, and adding: “Equifax will work with UK and Canadian regulators to determine appropriate next steps.”
So if these events had been shifted just a few months into the future Equifax might well have been forced to handle the breach disclosure very differently — or else it would be risking a very large fine under GDPR.
The question then would be, would it have informed the UK regulatory of the breach within 72 hours whilst continuing to keep U.S. data watchdogs and U.S. consumers in the dark? That wouldn’t seem like great domestic PR.
The aim of Europe’s new rules is of course to encourage companies that collect and store consumers’ personal data not to treat the security of that data as an afterthought. And large fines for failure is certainly one way to grease the pipe of security spending among corporates.
As the UK’s DPA warns on its website in an FAQ about the new breach notification rules: “In light of the tight timescales for reporting a breach – it is important to have robust breach detection, investigation and internal reporting procedures in place.”
While an interesting potential side-effect of the new, tougher regime is whether it will end up forcing higher standards on non-European businesses, especially those in the U.S. — given many do handle EU citizens’ data, and will therefore need to reconfigure their processes to meet the bloc’s new standard.
(The GDPR also expands the definition of what personal data is, and brings additional requirements such as a right for consumers to see what information is held about them and have it deleted on request — so there are other big changes incoming.)
We’ve reached out to Equifax in the UK for comment and will update this post with any response.
In a statement, the deputy commissioner of the UK’s data protection watchdog, commissioner James Dipple-Johnstone, told us: “Reports of a significant data loss at US-based Equifax and the potential impact on some UK citizens gives us cause for concern. We are already in direct contact with Equifax to establish the facts including how many people in the UK have been affected and what kind of personal data may have been compromised.”
“We will be advising Equifax to alert affected UK customers at the earliest opportunity,” he added.
I’ll leave you with this final food-for-thought:
",2017-09-08,1537814,https://tctechcrunch2011.files.wordpress.com/2017/09/gettyimages-585288019.jpg?w=738,europe/,"computer-security,data-breach,equifax,security",Equifax breach disclosure would have failed Europe’s tough new rules,,https://techcrunch.com/2017/09/08/equifax-breach-disclosure-would-have-failed-europes-tough-new-rules/
Mike Butcher,Europe,"You’d think all the business models around on-demand taxis and cars had been invested, but straight out of Siberia comes another one.
Ride-hailing app inDriver has raised a $5 million Series A round from Russian venture fund LETA Capital. They aim to use this cash to launch inDriver in India, the USA and Canada, where the service will of course compete with Uber, Lyft and Ola Cab.
How on earth will they attempt this, rather optimistic, feat? Well, for starters, drivers themselves pay for to access the app, rather than the app’s operation effectively being subsidised by venture capital, as the other are. Next, inDriver is a decentralized, bid-style service, where the passenger enters the price he or she is willing to pay, while the driver accepts the order only upon agreement of the fare. inDriver does not influence price formation and doesn’t take a commission from drivers. All drivers do is simply pay by the hour to use the app, at a flat rate. A passenger can pay either with cash, or with credit card, but payment happens only directly between driver and rider.
The service’s simplicity means it has expanded to 70 cities in Russia and neighbouring markets. It claims to have about 7 million installations across iOS, Android and Windows Phones. Each month inDriver’s users make around 4-5 million trips, and the total number of trips is close to 100 million, they claim. inDriver also offers the option to travel between cities, much like BlaBlaCar.
The inDriver service was created in Yakutsk – a small town in Siberia. Their story goes that during a freezing winter day on Christmas Eve, when the temperature fell to -49°F, all the local taxi services simultaneously doubled their prices. To fight this, some students formed a public group on the VK.com social network (a clone of Facebook), where anyone could submit an application for a ride, and those who owned cars could accept their calls for help. After a year the group had 50,000 subscribers. Later, Yakutian tech entrepreneur Arsen Tomskiy “bought” the group from its creators (only in Russia could you buy a VK group…) , releasing a mobile app based on the group. QED.
inDriver says its has been profitable from its first year of existence, because the company does not subsidize its drivers, like Uber does. When the app is launched in a new city, it is free for all drivers for the first several months, and later the company adds a subscription fee to access the order database. In Russia, depending on the city, the price can vary from $0.50 to $2 per hour. Pretty competitive.
CEO Arsen Tomskiy said they chose LETA Capital because it “already has the experience of successful international exits from companies’ portfolios, including the recent sale of a stake in the Unomy start-up to the international giant WeWork.”",2017-09-07,1537467,https://tctechcrunch2011.files.wordpress.com/2015/01/beijing-taxi.jpg?w=738,europe/,leta-capital,Straight outta Siberia — inDriver raises $5M for its flat-rate ride-hailing app,,https://techcrunch.com/2017/09/07/straight-outta-siberia-indriver-raises-5m-for-its-flat-rate-ride-hailing-app/
Romain Dillet,Europe,"French startup Streamroot just raised $3.2 million from Partech Ventures, Techstars Venture Capital Fund, Verizon Ventures* and R/GA. The company is taking advantage of WebRTC to make video streaming much cheaper.
When you’re watching a video on YouTube or Netflix, those companies send a video file to your device from their servers. It’s a straightforward, one-way transaction between a data center and your device. That’s why tech companies spend a ton of money on bandwidth because video files are heavy.
Streamroot wants to change this model by adding a peer-to-peer layer. Companies like Dailymotion, Canal+, Eurosport and Russia Today have been using Streamroot’s technology so that not all videos come from their servers.
Let’s say you’re watching Taylor Swift’s latest music video on Dailymotion. As Taylor Swift is quite popular, chances are a bunch of people are already watching her video at the same time. Streamroot is going to download part or all of her video from another user directly.
So Dailymotion can deliver 2 different views without sending the file twice from its own servers. It works particularly well for big spikes of traffic on the same video.
The best part is that it’s completely transparent for the user. You don’t have to install anything as most modern web browsers support WebRTC’s most advanced features on desktop and mobile. And if you’re watching an obscure video, Streamroot will just tell your browser to look for the video on a traditional server. It’s the best of both worlds
Streamroot now powers 400 million video sessions per month. The company says that 50 to 80 percent of customers’ traffic now takes advantage of this distributed infrastructure.",2017-09-07,1537406,https://tctechcrunch2011.files.wordpress.com/2017/02/gettyimages-493420504.jpg?w=738,europe/,"france-newsletter,partech-ventures,streamroot",Streamroot raises $3.2 million for its peer-to-peer video delivery technology,,https://techcrunch.com/2017/09/07/streamroot-raises-32-million-for-its-peer-to-peer-video-delivery-technology/
Natasha Lomas,Europe,"European Union defense ministers have been taking part in a simulated cyber attack exercise today for the first time to practice strategic decision making and crisis-management under pressure of a (mock) cyber-attack against the bloc’s military structures.
The two-hour war game exercise, named EU CYBRID 2017, was held in Tallinn, Estonia, where the EU defense ministers are meeting for informal discussions on a range of security issues.
Cyber attacks targeting and damage civilian infrastructure, such as powerplants, was not included in this particular exercise. Although recent malware activity, such as the Wannacry ransomeware attacks, which locked some UK hospitals out of their IT systems and led to operations being canceled, likely contributed to the decision to run the exercise, said a minister of defense spokeswoman.
She said the fictitious scenario focused on threats to military operations in the Mediterranean.
According to Reuters the exercise involved the EU’s naval mission in the Mediterranean being sabotaged by hackers who cripple the mission’s command on land while also launching a campaign on social media to discredit EU operations and provoke protests.
The exercise was generally aimed at giving ministers the chance to practice situational awareness, crisis management and strategic communication between member states — with the overarching goal of moving towards establishing a policy guideline for the European Union to adopt in the event of such a cyber war situation.
Increasing defense ministers’ awareness about the potential scale of risks posed by cyber attacks appears to be an early take-away from the exercise, according to the spokeswoman.
“What we’ve seen is that the ministers were very interested in it, and it gave them an overview of the threat and what could happen actually because the scenario was built up in such a way that the situation is escalating,” she told us. “In the beginning it might seem like a small thing… It’s pretty hard to assess how big a deal it is. They got an overview that it can escalate to a very, very serious business and that can attack also the military operations.”
“The exercise wasn’t about finding a very concrete, one solution. It was just to get the [understanding] to watch this road,” she added, emphasizing that it’s the first time such an exercise has taken place with defense ministers — and describing it as the “first step” on the road towards a better “common understanding”, which is the necessary base for the EU being able to establish guidelines to respond to (real) cyber attacks against its military structures.
Commenting on the exercise in a statement, Estonia’s minister for defense, Jüri Luik, added: “The cyber world and cyber threats do not recognise national boundaries or the barriers between organisations. It is therefore important to perform joint exercises of this kind, between European Union member states as well as the EU and NATO. We must exchange information and have a common understanding, in order to ensure improved preparedness for dealing with cyber threats.”",2017-09-07,1537058,https://tctechcrunch2011.files.wordpress.com/2017/09/eucybrid2017.jpg?w=738,europe/,"national-security,hacking,cyberattack,cyberwarfare",EU defense ministers take part in first cyber war game,,https://techcrunch.com/2017/09/07/eu-defense-ministers-take-part-in-first-cyber-war-game/
