authors,category,content,date,id,img_src,section,tags,title,topics,url
Jon Russell,Asia,"Grab is going all out to win the nascent ride-hailing market in Myanmar after it committed to investing $100 million into the Southeast Asian country over the next three years.
Myanmar might just be the world’s most fascinating internet market. Internet access had been heavily restricted when the country was fully controlled by the military, but it opened up following the free elections in 2015.
A huge adoption of mobile services followed as businesses, including operators and tech companies, flowed into the once reclusive country sensing an opportunity. Increased competition saw the cost of a SIM card, which was once $200 or upwards of $1,500 during military rule, drop to below $5 prompting the country’s 55 million population to move to mobile en masse.
Today, Myanmar has more registered SIM cards than people — a fact that was unthinkable just half a decade ago — and, with no real legacy fixed internet, the country has made a leap to mobile like no other place on earth.
E-commerce was an obvious first focus of Myanmar’s tech wave, and local takes on Uber popped up in recent years as smartphones became more widely owned. Earlier this year, the ride-sharing industry was shored up when Grab and Uber expanded into Myanmar, marking the seventh market in Southeast Asia for both services.
Now, Grab is claiming leadership — with 25,000 daily bookings and 6,000 drivers since its launch in March — and it has revealed an aggressive plan to cement its position.
As it has done in Indonesia, Southeast Asia’s largest economy, the Singapore-headquartered company has unveiled an investment package (at $100 million) to grow its business and move beyond transportation services. Doubtless its recent $2 billion funding has given the opportunity to initiate this program.
The initial focus early on centers around expanding the Grab service from capital city Yangon into other parts of the country, and increasing its local team to 200 people. But Grab is also looking to deploy its digital payment services in Myanmar, as it has done in Indonesia. Its in-app GrabPay wallet is foremost a way to pay fares without using cash, but it has been extended to offer a rewards program in partnership with a range of well-known retailers in a bid to stoke loyalty among Grab passengers.
In Indonesia, Grab is also working to offer payments outside of car services and it looks like it may do the same in Myanmar at some point since credit card ownership is below five percent and the jump to mobile leaves Myanmar open to digital payment systems.
“Our commitment to address transport challenges with locally suited and innovative solutions that create more social and economic opportunity works well for both Grab and our local communities. This is already one of our fastest-growing markets, and we are very excited to deepen our commitment into Myanmar,” Grab CEO Anthony Tan said in a statement.
Outside of mobile operators, Grab is one of the earliest consumer tech companies to make such a commitment to Myanmar. But you can expect more to follow as the opportunities in Myanmar continue to open.",2017-08-24,1531404,https://tctechcrunch2011.files.wordpress.com/2017/08/photo-03-05-2017-10-08-12-am.jpg?w=738,asia/,"grab,myanmar,asia",Grab is investing $100M to shut Uber out of fast-growing Myanmar,uber,https://techcrunch.com/2017/08/24/grab-is-investing-100m-to-shut-uber-out-of-fast-growing-myanmar/
Anthony Ha,Asia,"WeWork just announced that it’s receiving a massive $4.4 billion investment from SoftBank Group and SoftBank Vision Fund.
It’s been less than a month since WeWork announced $500 million in funding for a standalone WeWork China business, which SoftBank participated in. It’s also launching in Japan through a joint venture with SoftBank — so this funding deepens an already-strong relationship between the coworking company and the Japanese giant.
The companies say the funding breaks down to $3 billion invested in WeWork itself (both through a primary investment and a secondary purchase of existing shares) and $1.4 billion in the companies created for WeWork’s expansion in Asia — namely WeWork China, WeWork Japan and WeWork Pacific. (The $1.4 billion includes SoftBank’s previously announced investment in WeWork China.)
“[SoftBank CEO] Masayoshi Son is a visionary business leader and we are humbled by this strong endorsement of our mission and purpose,” said WeWork co-founder and CEO Adam Neumann (pictured above) in the announcement. “This support from SoftBank and the Vision Fund will provide even more opportunities for creators as we set out to humanize the way people work and live.”
WeWork says it currently has more than 150,000 members across 160 locations in 16 countries. As a result of this investment, SoftBank Group’s Ronald D. Fisher and Mark Schwartz are joining the company’s board of directors.",2017-08-24,1531132,https://tctechcrunch2011.files.wordpress.com/2017/05/tcdisrupt-ny17-8735.jpg?w=738,asia/,"softbank-vision-fund,softbank-group,softbank,wework",SoftBank pours $4.4B into WeWork,,https://techcrunch.com/2017/08/24/softbank-pours-4-4b-into-wework/
Ingrid Lunden,Asia,"The online food ordering-and-delivery market, once very hot, appears to be cooling down a little in China. Today Baidu, the country’s search giant, announced an exit from the business: Baidu has confirmed that it has sold its Xiaodu food delivery subsidiary (which operates under the Waimai brand) to Rajax, which operates Ele.me, China’s leading food delivery business that is valued at around $6 billion and counts Alibaba, Tencent and Sequoia among its investors. The deal is reportedly valued at around $800 million (see more detailed explanation below) and gives Baidu a small stake in the bigger operation.
In a short statement announcing the news, Baidu said that Xiaodu is now a subsidiary of Rajax and that Baidu and Rajax had inked “a business cooperation across a broad base of products and services following completion of the merger.”
A Baidu spokesperson has declined to disclose the value of the deal. We are continuing to dig around, but as a potential range, consider that when rumors of this sale were first reported a few days ago, it was estimated to be $500 million for the business, plus $300 million in an additional traffic agreement, amounting to an $800 million deal. But also consider that last year, Waimai’s valuation was estimated at around $2.5 billion.
Taken together, this could mean that the price was actually higher today, or that Baidu was particularly keen to offload this asset, even at a knock-down price.
The divestment underscores a persistent fact in the bigger market for online food delivery: the logistics involved plus the investment needed to acquire and keep customers in competitive markets makes food delivery a very cost-intensive business that has proven challenging for many to bring into the black.
Even the biggest players like Delivery Hero, which has gobbled up a number of rivals over the years, and raised well over $1 billion in funding in a play for economies of scale, is not profitable in all of its markets, and overall was still loss-making when it went public earlier this year. (It, too, incidentally pulled out of China last year amid huge competition.) More recently Blue Apron has been feeling the pinch.
That’s before you consider the plethora of smaller startups that have sold up or shut down rather than grown on their own.
In that context, Baidu was a parent with deep pockets and a specific mission: the company has been very keen to grow out from its core search business into a number of adjacent areas that both could help the search business continue to grow, and also help Baidu diversify its own revenue base.
It’s a strategy also taken by other search giants: Google has its own shopping services that it has been trying to build out; Yandex in Russia has built out a number of businesses in areas like on-demand transport and more.
Baidu’s retreat signals not just that it may be pulling away from costly e-commerce ventures like this, but also that its focus is getting stronger on other areas.
Specifically, the company has been doubling down on what is likely going to form the core of the next generation of computing, artificial intelligence, and the many applications that this will take, whether it is in powering services like transportation or providing information to Baidu’s user base. It’s also been making some acquisitions in line with this, such as its purchase of Kitt.ai earlier this summer.
(Notably, other food-related ventures that tap into this new wave of computing, like this one with KFC to facilitate ordering using face recognition technology, will not be affected by today’s news, Baidu confirmed to TC.)
Additionally, Baidu is moving deeper into investing in other areas. The company now collaborating with insurance giant China Life (a partner in other investments) on a new $1 billion private equity fund called the “Baidu Fund Partnership“. Capitalized with 5.6 billion yuan from China Life and 1.4 billion from Baidu, the fund will focus on late-stage investments in tech startups with a significant presence in China with a focus on mobile, AI, and finance.
Baidu may have lost its appetite for the food delivery market for now, but that’s not to say that there are not others who are licking their chops for more.
Ele.me continues to grow massively, and others like Uber and Amazon are also doubling down in this area, building out from their logistics operations as a base for growth. As more of our economy shifts to consumers using digital platforms to buy goods and services, there’s a clear opportunity there for those hungry to seize it.",2017-08-24,1530911,https://tctechcrunch2011.files.wordpress.com/2017/04/gettyimages-626189980.jpg?w=738,asia/,"china,food-delivery,ele-me,baidu",Baidu sells food delivery business to its rival Ele.me,,https://techcrunch.com/2017/08/24/baidu-confirms-sale-of-its-food-delivery-business-to-rival-ele-me/
Jon Russell,Asia,"Eko Communications, a U.S.-Thailand company that operates a messaging app targeted at businesses, has closed a strategic investment of $2 million to grow in Japan and expand into Europe and the U.S..
The funding was led by Japanese corporate Itochu, which provided $1 million and will partner to help expand sales. Existing backers of the company, which include Gobi Ventures, also took part.
Eko provides a mobile messaging app that includes a range of productivity and employee development tools baked in. It was founded five years ago by Thai student Korawad Chearavanont while he was studying in New Jersey. We wrote a longer story about the company in 2015 when it raised $5.7 million.
Chearavanont told TechCrunch that the business counts over 150,000 active monthly paying subscribed licenses, that is the total number of employees on the platform from its paying customers. There is also a free service. The company didn’t divulge revenue data, but it said sales has grown by 630 percent over the last year.
Most paying clients are located in Asia, with around 30-40 percent from China, and this new investment will help find deeper growth in Japan while kickstarting its U.S. and UK businesses, having just opened sales offices in those two countries.
“It seems like many Japanese companies are implementing policies that are favorable to use,” he said in an interview. “This is strategic investment to spark a partnership, we saw this as the opportunity to have access to a huge company, with a vast software business in Japan and international reach.”
Chearavanont who is the grandson of Southeast Asia’s richest man — Dhanin Chearavanont — added that he wasn’t initially looking for investment. He said the partnership with Itochu opened this opportunity to push on to gain momentum before a planned Series B round next summer.
“By showing we can grow in huge IT markets, we can justify a large round. That’s what is needed to invest in tech since we compete with global giants like Facebook and Microsoft,” he said, adding that 80 percent of the startup’s expenditure to date has been on product.
While Eko has found success with large corporate companies in Asia — eleven of its clients have a market cap in excess of $2 billion, it claims — it is looking at small businesses for initial traction in Western markets before fanning out to seek larger clients.",2017-08-24,1530890,https://tctechcrunch2011.files.wordpress.com/2017/06/gettyimages-539253463.jpg?w=738,asia/,"eko-communications,computing,software,internet-culture","Business messaging service Eko picks up $2M to fuel push into Japan, US and UK",,https://techcrunch.com/2017/08/24/eko-communications-2-million-japan-us-and-uk/
Jon Russell,Asia,"Google is launching its public Wi-Fi program, which offers free connectivity at railway stations and other locations such as universities, in Indonesia, the company announced today.
The Indonesia launch is the first expansion of ‘Google Station’ — as the program is called — since it debuted in India some 18 months ago.
The project is quite simple, it offers a free way to get online with a decent quality internet connection. The idea is that beyond making it easy to get public Wi-Fi — because let’s face it, it is usually a struggle — Google Station offers connectivity those who might otherwise be unable to afford it, or perhaps even unaware of it entirely.
Google works with a range of partners that include ISPs, venue owners and system integrators on the project. It also enlists the help of ISPs and device makers to help get support and optimization for the networks on phones/phone connections themselves and reduce costs.
The project in India began with Mumbai Central station in January 2016, and last September it expanded beyond public transportation to include stations across the country, shopping malls, bus stops, cafes and more. Google claims the service is in over 150 stations, which helps it enable “millions” to go online each day. Interestingly, it claims 15,000 people in India go online for the first time using the public Wi-Fi service each day.
The Indonesia roll-out is targeting “hundreds of venues” across Java (hope to capital city Jakarta) and Bali over the next twelve months. Google said it is working with service providers CBN and FiberStar to bring the idea to life.
In addition, Google also expanded its data-friendly YouTube Go app, which was previously only available in India, to Indonesia.
Indonesia is increasingly a focus for technology companies that see the internet as a game-changer for the country’s 260 million population, that’s the world’s fourth highest. Whether it is fintech, e-commerce or taxis on-demand, the internet has the potential to change daily lives and enable new services, but getting decent access is the critical component.
India has been a key market for most tech companies in recent years, but lately Indonesia, Southeast Asia’s largest economy, has also begun to command attention in its own right. According to a report co-authored by Google last year, Southeast Asia’s internet economy is projected to grow 6.5-fold to reach $197 billion by 2025. Indonesia is expected to represent around half of that value, and that includes key categories like e-commerce and ride-hailing.",2017-08-23,1530875,https://tctechcrunch2011.files.wordpress.com/2017/08/google-sign.jpg?w=738,asia/,"computing,technology,wireless,wi-fi",Google expands its public Wi-Fi program for emerging markets to Indonesia,,https://techcrunch.com/2017/08/23/google-station-indonesia/
Darrell Etherington,Asia,"Automaker Ford will team up with local partner Anhui Zotye Automobile to create a new joint venture in China aimed specifically at producing electric cars. The deal will see Ford and its new partner sell the vehicle sunder a local brand, rather than with its “Ford” name, and ultimately its aim is to produce even more electric vehicles for a market where there is strong incentive to bring EVs to consumers.
This is the third joint venture Ford has set up with local Chinese automakers. It’s standard practice for foreign car companies to partner with local Chinese vehicle producers, as a way to avoid having to pay very high import taxes on vehicles made by exclusively foreign-controlled concerns.
Ford has two JVs set up with other automakers including Changan Automobile and Jiangling Motors, and normally that’s the upper limit for joint ventures allowed by Chinese industry regulators. Recently, however, Beijing added an allotment for a third joint deal, provided its focus is specifically electric vehicle manufacture.
China is doing a lot to boost electric car adoption in the country, including adjusting the rules for automakers in terms of how much of their total output must be EVs. Zotye, Ford’s new partner, is an electric car specialist, with a total of 16,000 EV sales so far in 2017. Overall, Ford is aiming to make sure that 70 percent of the cars its offers in China are electric vehicles by 2025.
Ford’s not alone in building new JVs in China focused specifically on electric: Volkswagen announced plans to create its own third venture with a Chinese partner earlier this year, with production to begin in 2018.",2017-08-22,1529622,https://tctechcrunch2011.files.wordpress.com/2017/08/17_frd_fcs_200031_electric.jpg?w=738,asia/,ford,Ford set to create a new joint venture to produce EVs in China,,https://techcrunch.com/2017/08/22/ford-set-to-create-a-new-joint-venture-to-produce-evs-in-china/
Jon Russell,Asia,"While talk of Spotify’s apparent upcoming IPO continues in the U.S., the music streaming service is furthering its coverage of Asia after it launched its service in Thailand.
Spotify Premium, which counts over 60 million paying users, will cost 129 THB in Thailand. That’s just over $4 and in line with its pricing across Asia. Customers in the U.S. and UK will be aware that it is substantially cheaper than what they pay, but Spotify has opted for local pricing worldwide.
Interestingly, Spotify will introduce daily and weekly packages to boost its potential in Thailand, where revenue from online music has actually declined by over 20 percent since 2012, Spotify Asia head Sunita Kaur told media at a press conference
The launch — which we reported was on the cards back in May — takes Spotify to 61 markets worldwide, and it is emblematic of the company’s recent focus on expanding its business in Asia.
Spotify first entered the region in 2013 with launches in Hong Kong, Singapore and Malaysia, it only added one new market over the next two years. It restarted its expansion plan in Asia last year when it launched its service in Indonesia, Southeast Asia’s largest economy and the world’s fourth largest population, and Japan, which is the world’s second most lucrative music market. Today’s launch takes it to seven countries in Asia, not including Australia and New Zealand when looking at the wider Asia Pacific area.
As we reported back in May, Vietnam is the next country in its sights, as evidenced by job listings and sources. India is a market that we understand Spotify has looked at seriously, but for now it has not committed to a launch.
Getting a solid position across Asia will help Spotify when it does finally go public. The latest reports suggest that will be via a direct listing, an unorthodox approach that involves going public without an IPO. Spotify is potentially missing out on hundreds of millions in proceeds from the IPO, but it could do a secondary offering to raise cash at a later date.
It’s also under pressure to compete with Apple Music, which is available worldwide. Spotify had an early head-start and it added 20 million paid subscribers in less than a year. It’s taken Apple Music more than a year and a half to make that progress. Spotify now has 60 million subscribers, compared to Apple Music’s 27 million, as of June.",2017-08-21,1529565,https://tctechcrunch2011.files.wordpress.com/2017/03/gettyimages-506028296.jpg?w=738,asia/,"computing,initial-public-offering,online-music-stores,software",Spotify launches in Thailand to continue its Asia push,,https://techcrunch.com/2017/08/21/spotify-thailand-launch/
Jon Russell,Asia,"German automotive giant Continental is furthering its push into the future of transportation after it got its check book out to acquire Quantum Inventions, a Singapore-based company that specializes in mobility data services.
The deal was announced in July with little fanfare and it is officially undisclosed, but a source told TechCrunch that it is around the SG$40 million mark — that works out to around $29 million. That’s a pretty significant exit — both in name of acquirer and deal size — for Southeast Asia’s nascent yet promising tech ecosystem.
You’d be hard pressed to call Quantum Inventions a startup, although it certainly operating in startup style. The company was founded in 2006, over ten years ago, and it has 120 staff across offices in Singapore, India, Malaysia and Indonesia. It is focused on ‘mobility solutions’ in the consumer, automotive and government/enterprise sectors. That’s a fairly broad term but essentially it means managing data to make navigation-related services run smarter and more efficiently.
One example is the work that the company has done in Singapore, where its technology has been used to used to the government develop a new satellite-based Electronic Road Pricing system, which handles tolls, parking and other fees and is designed to ease congestion. Quantum Inventions works with a Mitsubishi affiliate, which won the project’s tender, and Singapore’s NCS to manage the vast data output to glean insight and information.
“Compliance from technical standpoint very important,” Saurav Bhattacharyya, Quantum Inventions CEO, told TechCrunch in an interview. “Human compliance in any kind of system is the main issue, moving towards autonomous or advanced systems you have higher level of compliance and that’s where a central-backed congestion management platform in real-time can get to many places.”
The company doesn’t just focus on smart cities — though that is a strength of Singapore — and its other units touch on enterprise services like fleet management, in-car consumer services, and mobile apps and data such as navigation.
Bhattacharyya said that right now, mobility data is managed in commonly managed in silos, but he said this practice will change in the future as increased usage of the cloud and city planning centralizes data and processes.
The business itself had become profitable with 50 percent compound growth over the past decade, so why sell now when the future is still to come?
Bhattacharyya said the initial plan was to go to market to raise funding, but after being subject to acquisition interest, Quantum Inventions looked at its options. Beyond a financial exit for investors and the team, he said it was drawn to Continental as a partner that can open doors while adding tech and other resources.
“We had a few suitors over the last year, one of the important things for us was to ensure we have a company that knows it takes R&D to stay ahead and have global relationships,” he said. “You can raise $100 million but can’t buy relationships.”
On that latter point, he expects that his company will be able to develop much faster with more resources at its fingertips.
“We come in as a strong engineering fit,” Bhattacharyya added. While the deal “leaves us independent, with the backing of Continental’s global channels — that’s testament to what we have created.”
For now the plan is to continue the business as it is — with an enrichment of resources — but in the future as the market changes, so the business may also shift its focus.
“We will keep our verticals but may align to certain strengths or relationships that Continental has, but still covering automotive and cities. Logistics is very strong and we’ll intend to keep doing that, maybe couple of years down the line makes sense to harmonize platform into one,” he explained.
Continental has been busy brokering deals in Asia lately. It recently announced a joint venture with operator China Unicom focused on transport systems, and it has partnered with Baidu to develop self-driving cars.
“Asia continues to play an ever increasing role in our strategy,” Helmut Matschi, member of the Executive Board at Continental and head of the Interior division, said in a statement. “Now the purchase of Quantum Inventions underline our focus on developing mobility services solutions. We are excited to provide an expanded portfolio of customized solutions in the dynamic mobility services market.”",2017-08-21,1527416,https://tctechcrunch2011.files.wordpress.com/2016/02/shutterstock_244507771.jpg?w=738,asia/,"blogs,business,world-wide-web,economy",Auto giant Continental buys Singapore-based Quantum Inventions for $29M,,https://techcrunch.com/2017/08/21/auto-giant-continental-buys-singapore-based-quantum-inventions-for-29m/
