authors,category,content,date,id,img_src,section,tags,title,topics,url
Jon Russell,Asia,"China banned ICOs this week and it is investigating platforms that facilitate them. Over in nearby Japan, one company is hatching an ambitious plan to offer a one-stop-service to let companies across the world take advantage of blockchain technology and IPOs. And all without violating financial regulations.
Tech Bureau currently helps companies with consultancy and a range of technical services, but it is preparing to introduce new platforms to cover nearly every aspect of the process of an ICO, also known as token sales, and chiefly that of raising capital.
The scope of ICO work will span developing the initial white paper (similar to a pre-IPO prospectus), to technical integrations, managing the sale process and even community management and marketing. On the technical side, it already operates its own “mijin” blockchain based on NEM protocol for developers for deployment and “Zaif” bitcoin exchange where coins are sold, so the final piece is facilitating the token sale itself.
The company this week announced that it has raised $15 million from Japan’s largest VC firm JAFCO to kickstart it plans. It previous raised $10 million. The money will be used to put the first building blocks in place, including hiring talent and opening at least four offices worldwide, to develop Japan’s first ICO platform, COMSA, and take advantage of the interest in bitcoin in the country and a boom in crypto currency funding that has already passed $1.7 billion this year.
COMSA will take a different approach to platforms like ICOage and ICO.info in China. The Chinese services were ideal for buyers, offering a one-stop solution to buying into ICOs, and companies selling tokens, since they could almost guarantee that a chunk of the token sale would come from China. With COMSA, Tech Bureau wants to be more selective and tie the sale process into its other services.
“We help implement token/blockchain tech to businesses in a way that businesses can add value to the tokens they issue,” CEO Takao Asayama told TechCrunch. “We will be a catalyst or I would say a conduit between the decentralized public blockchain world and the centralized, legit and working businesses.”
Asayama told TechCrunch that the platform could host 20-30 token sales before the end of next year, all of which will be with “legit and working businesses.” Four are slated to come this year, with crowdfunding site Campfire and public-listed Premium Water Holdings set to go first.
The first step of the process seems Tech Bureau help companies wanting to hold ICOs analyze how they can implement blockchain technology into their business, a critical factor that is often overlooked by the fact that companies can raise considerable amounts by token sales. A genuine integration is one factor that would be used to judge whether a token sale is legitimate, or not. Another — and the big crypto question, being asked by the SEC and other regulators worldwide — is whether the token on offer falls under securities law.
On that subject, Japan has been fairly accommodating to bitcoin as an asset — it is accepted fairly widely by retailers — but, like most other countries, its position on ICOs is less clear, particularly if and when tokens fall under securities laws.
That doesn’t concern Tech Bureau, because the company does extensive diligence and already provides advice around whether a token sale structure might fall under the jurisdiction of financial regulators.
“As long as you handle only non-security tokens, it is ok,” explained Asayama. “Once it circulates in the market, it becomes virtual currency. We help implement token/blockchain tech to businesses that way they can add value to the tokens they issue.”
The plan is to take the model global — in terms of both token issuers and token buyers — and already 50 percent of inbound interest for ICO companies is from outside of Japan, Asayama said. Given the international scope, some level of risk management will be implemented with users. Those based in China, for one, are likely to be excluded from the COMSA platform.
While the platform is still being developed, Tech Bureau has already attracted 150,000 registered users who, once it is online, will be able to invest in ICOs hosted on COMSA. One key component to attracting that audience is COMSA’s own ICO.
Yes, of course the platform that will host ICOs is running its own ICO first!
Asayama said that the VC cash will go towards constructing the business, and hiring, but its own ICO will fund the development of the COMSA platform and other blockchain-based services that for integration
The plan is to raise money through an uncapped sale to registered COMSA users following an initial $10 million pre-sale to major investors. Asayama said the sale would uncapped to prevent so-called ‘pump and dump’ strategies from investors who get into a closed cap sale and release a token into the market at a higher price once it is generally available to all.
“We consider this a platform not a one-time token sale,” he explained. “And we have confidence of ongoing growth in value of the CMS token.”
He said an ideal sale would raise upwards of $50 million. The token sale itself will run from October 2 to November 6, according to details on the dedicated website.
Token ownership will include a number of benefits, including decisive votes on potential COMSA projects.
“If there are some challenging businesses coming along with certain risk, we can take community vote, based on the number of our tokens they own. The community can decide if they want that business to go ICO or not,” Asayama explained.
Experts have warned that China’s ICO ban could allow other global markets to take the lead on token sales, and it looks like that’s exactly the objective here.
“With a foresighted approach, Japan appears to be taking the lead in managing the growth of the cryptocurrency industry. Major venture capital companies are pouring in money, and the industry is well on its way to becoming a major economic force,” said Lon Wong, President of the NEM.io Foundation which has collaborated with Tech Bureau.
Note: The original version of this story has been updated to provide more accurate information around the planned token sale.",2017-09-08,1537812,https://tctechcrunch2011.files.wordpress.com/2017/09/photo-08-09-2017-6-54-40-pm.jpg?w=738,asia/,"blockchains,cryptocurrencies,icos,japan",Japanese startup plans one-stop ICO platform fueled by VC investment and an ICO,,https://techcrunch.com/2017/09/08/japanese-startup-plans-one-stop-ico-platform-fueled-by-25m-from-vcs-and-a-60m-ico/
Jon Russell,Asia,"UrWork, the unicorn that is competing with WeWork in China, is following its American rival’s lead by extending its reach in Southeast Asia after it took part in a $3 million funding round for Indonesia-based ReWork.
The round, which is described as pre-Series A, was led by China-U.S. firm ATM Capital and Indonesia’s Convergence Ventures. UrWork was a participant alongside U.S. firm Social Capital (which is increasingly active at Indonesia), Fortune Union Investments, ACE Capital and other undisclosed backers.
UrWork is valued at $1.5 billion following recent financing. It has 88 locations in 22 cities in its native China, but it is planning an aggressive overseas expansion into 32 cities worldwide over the next three years. That’s just as WeWork doubles down on China, where it recently launched a local business that is aimed at rapidly growing the eight spaces it currently operates across the Greater China region.
Just as we have witnessed Chinese tech firms moving rapidly into Southeast Asia to grab a slice of the fast-growing startup ecosystem, so the co-working unicorns have taken aim at the region, and Indonesia — its largest economy — in particular.
WeWork expanded into Southeast Asia via the acquisition of Singapore-based SpaceMob, and it has set aside a budget of $500 million to grow in Southeast Asia, which houses over 600 million people.
Already, UrWork has a location in Southeast Asia via Singapore in addition to a presence in the U.S., but now it is looking to expand into Indonesia, the world’s fourth most populous country, through this deal.
“Southeast Asia’s economy and technology market are extremely promising with huge growth potential for both local ventures and for China based businesses. We see it as a very strategic destination and are working with Rework to further open up the market and support local and overseas companies grow through the development of collaborative work spaces,” Mao Da Qing, who is CEO and founder URWork, told TechCrunch in a statement.
ReWork founder and CEO Vanessa Hendriadi told TechCrunch that UrWork’s strategic investment will give leverage for future alliances with clients and retail estate partners. While of course UrWork will help with its experience and know-how.
“UrWork was very impressed with the ecosystem, the companies they met and the country in general” after first visiting Indonesia last year, Hendriadi said in an interview. “The deal is very timely, they’d just finished their funding round, became a unicorn, opened up in Singapore and are keen to expand in Southeast Asia.”
Unlike WeWork-Spacemob, there’s been no talk of an outright buy-out of ReWork, according to Hendriadi.
“Right now, the partnership goes around exchange of resources,” she explained, adding that the two companies’ technologies and apps will be integrated in the near future. “We can be the landing platform for Chinese companies wanting to come to Indonesia and be plugged into the ecosystem.”

ReWork currently operates two locations in Indonesian capital Jakarta, a city with over 10 million inhabitants that’s known as a global social media hotspot. The startup is planning to add another four locations in Jakarta over the next six months, before moving to other major urban areas, including Bali and Bandung. There’s no immediate plan for regional expansion, but the it is looking at possible moves into the Philippines and Malaysia next year.
Business-model wise, ReWork typically works with property owners on a revenue-share basis, but, as it eyes more rapid expansion, it is in talks with larger real estate companies over joint ventures that could add multiple spaces to its presence in one go, Hendriadi said.
It’s also taken an interesting twist on expanding via a tie-up with commercial property group Ismaya. That deal will see small ReWork outposts opened alongside Ismaya locations, which include shopping malls and office buildings, to give members more flexibility with work options and help reach new demographics.
Echoing others in the co-working industry in Asia, including aggregator FlySpaces, Hendriadi said the main meat of the business is in established companies and corporates, rather than digital nomads or small teams — although they are also catered to. She believes the current system is seriously lacking, and that’s the gap ReWork aims to plug.
“Traditional serviced offices are very soul-less with very small shared facilities,” the ReWork CEO said. “All you want to do is go to your office and close the door, but sometimes it doesn’t even have windows!”

It’s going to get interesting when WeWork moves into Indonesia via SpaceMob, which is working on entering the country, while Naked, another massive competitor to WeWork from China, is also casting glances at Southeast Asia.
For now, ReWork — and UrWork — have the advantage, and investors seem impressed.
“Vanessa has grown Rework’s members and revenues quickly with healthy margins great retention, all while maintaining strong capital discipline. We’re excited to support her on this next stage of rapid expansion and growth,” Social Capital’s Ashley Carroll said in a statement.",2017-09-07,1537796,https://tctechcrunch2011.files.wordpress.com/2017/09/rework1.jpeg?w=567,asia/,"china,asia,southeast-asia,indonesia",China’s UrWork invests in Indonesia’s ReWork via $3M deal as WeWork rivalry heats up,,https://techcrunch.com/2017/09/07/iwork-uwork-wework-rework-urwork/
Jon Russell,Asia,"India-based OYO, a startup that pioneered and popularized the concept of budget hotel networks, has closed $250 million in new funding led by SoftBank’s Vision Fund.
The startup was founded in 2013 by Thiel Fellow Ritesh Agarwal, now aged 24, and the concept centers around standardizing the quality of India’s wildly differentiated affordable hotels, and providing some structure to make bookings simple and customer service simplified.
The answer is an app-based service that lets customers book hotels and manage their experience through their smartphone. Not just that but it also provides basic guarantees of service.
Being sure that you’ll get hot water, clean sheets, WiFi and a responsive concierge might not sound a lot, but they’ll give the average traveler piece of mind as anyone who has ever navigated India or other Asian emerging markets can testify to. Likewise, with prices of under 1,000 INR ($15.60), rooms are more affordable than many nationwide hotels while providing common quality.
OYO’s newest round is led by Vision Fund, the hugely ambitious $100 billion global fund led by SoftBank, which invested in OYO previously. It includes participation from existing backers Sequoia India, Lightspeed Venture Partners and Greenoaks Capital, while Hero Enterprise, an ambitious fund attached to motorbike and scooter maker Hero MotoCorp, joined as a new investor.
This new Series D round means that OYO has now raised $436 million from investors to date. The startup said it plans to use the capital to grow its reach in India, and expand its presence overseas.
As of now, OYO’s network spans 230 cities across India, Malaysia and Nepal, offering over 70,000 rooms in India alone. The company said it is getting close to growing its capacity at a rate of 10,000 rooms per month, and it plans to push on into more rural parts of India and move into additional overseas markets, too, although it isn’t being precise on which ones right now.
Its first overseas foray was Malaysia in early 2016 and, while it added Nepal in April of this year, that was some while ago. Perhaps the added competition in India, particular that of key rival Treebo, have kept it busy? Treebo just announced a $45 million round of its own last week, and it has been busy investing in TV ads to grow its brand, so the timing of this new OYO raise is particularly noteworthy.

In a statement, OYO CEO Agarwal said he also intends to invest in technology and improving the customer experience.
One area where it is diversifying out is with the younger generation. OYO launched millennial-focused brand Townhouse — “your friendly neighborhood hotel” that also serves as a breakfast/co-working venue — in January. Agarwal suggested that the product, which is aimed at the mid-market audience with prices upwards of 3,500 INR ($55), will be expanded nationwide after a promising start to life.
“OYO has solidified its position in India as the leading accommodation brand for consumer affordability and high quality standards. We’re excited to continue to support OYO as they further expand their position in India and bring the OYO promise of affordability and elevated hospitality to other markets around the world,” SoftBank’s Justin Wilson, who sits on the OYO board, said in a prepared comment.",2017-09-07,1537120,https://tctechcrunch2011.files.wordpress.com/2017/09/oyo-townhouse.jpg?w=738,asia/,"ritesh-agarwal,japan,vodafone,softbank-group",Budget hotel network pioneer OYO raises $250M led by SoftBank’s Vision Fund,,https://techcrunch.com/2017/09/07/oyo-raises-250m/
Jon Russell,Apps,"Chatbots may have underwhelmed thus far, but the impact of the technology still has bags of potential in international markets where mobile messaging has been mainstream for years.
That’s the view of one startup that’s working to bring the benefit of bots to the mainstream in Indonesia, the world’s fourth most populous country and the largest economy in the growing region of Southeast Asia.
Indonesia has been recognized as a global hotspot for social networks like Facebook, Twitter and Instagram in recent years, and messaging app adoption has been equally as strong with Line, Kakao, BlackBerry BBM and WhatsApp among the top choices for the country’s 260 million population.
Kata.ai, a Jakarta-based startup that recently raised $3 million, said it sees huge potential for many industries and segments to tap into the culture of chat to advance their business and customer relations. It operates a platform that lets brands and companies to operate chatbots using the native Bahasa Indonesian language, and not English which is not widely spoken with fluency.
“We are helping brands to provide better engagement, sell stuff and open new revenue generation channels,” Irzan Raditya, CEO of parent company YesBoss Group. “Chat already has a foothold in Indonesia, but now we want to demystify AI and open up other technologies to underserved markets.”
Right now, Kata.ai operates on a number of chat platforms, which include Facebook Messenger, Line, Telegram, Slack and BBM (which is still big in Indonesia), as well as Twitter and Skype.
WhatsApp, the world’s most popular messaging app, is a conspicuous absentee because the company has not yet opened its platform. However, that could change soon with this week’s announcement of plans to integrate business services into the app soon.
YesBoss Group began as a personal assistant service, but it pivoted into chatbots when Raditya noticed that the only solutions were global — and therefore in English — which could only ever have limited impact in markets like Indonesia. He then went ahead and started the first local platform for bots.

Mobile operator Telkomsel is one of the startup’s most visible clients today, using its platform to power its own-name chat bot that lets customers top-up their balance, change packages and check other information. The company plans to use this new funding — led by Taiwan’s Trans-Pacific Technology Fund — to push business-wise by creating its own in-house sales team. The core tech itself needs development and so a significant portion of the round will go towards hiring the AI and big data talent required.
That’s a tough ask in Indonesia where, despite a large population, there’s a lack of tech talent and particularly individuals with experience in AI and chatbot-related fields. For now, though, Raditya isn’t thinking of opening overseas offices to suck up talent, instead he’s looking locally and for those willing to move (or return) to Indonesia.
Likewise, there’s no immediate expansion plan, but he did suggest that the Kata.ai service will launch in new markets in Southeast Asia at some point next year. But with Indonesia forecast to account for half of the region’s fast-growing internet economy, the startup is at least starting out at ground zero.",2017-09-06,1536577,https://tctechcrunch2011.files.wordpress.com/2017/09/tsel-veronika-promo.jpg?w=738,asia/,"southeast-asia,indonesia,chatbot",Chatbot startup founder sees Southeast Asia potential despite slow start worldwide,,https://techcrunch.com/2017/09/06/chatbot-startup-founder-sees-southeast-asia-potential/
Jon Russell,Asia,"Event Pop, a two-year-old digital ticketing startup from Thailand, has raised a Series A round of over $2 million to expand its product and move into new markets.
The round was led by Thai investors InVent, a subsidiary of the parent of operator AIS, and Kasikorn Bank’s $30 million Beacon fund. Event Pop had previously raised $500,000. One of its backers is millionaire businessman Ittipat “Tob” Peeradechapan, who owns seaweed snack company Tao Kae Noi, and it has unnamed investors in Japan.
Event Pop helps event organizers with their ticketing and marketing efforts. It services include access control, cashless payments, data collection and management, and monitoring and analytics. To date, it has handled over 3,000 events, which it said includes gigs, festivals, live shows, sports and businesses seminars.
Beyond a website, its mobile app goes beyond finding and booking events to act as an entry ticket and, in some cases, a method to make cashless payments when at the event itself using NFC. (No more fiddling for cash at a gig.)
Event Pop CEO Pattaraporn “Max” Bodhisuwan told TechCrunch that the plan is to invest in new areas for services, and look into the potential to expand to parts of Southeast Asia and East Asia.
Bodhisuwan isn’t saying too much about the countries just yet, but you’d imagine that Indonesia, Southeast Asia’s largest economy, is on the list.
In terms of product, Event Pop has already gone beyond ticketing after adding in-event payments. Bodhisuwan said it will look at more features for festivals, sporting events and businesses to help event organizers and attendees get more both during the events themselves and outside of them, too.
A regional expansion would pit Event Pop against other ticketing companies that include Japan’s Peatix, Singapore-based EventNook and global players like Eventbrite.
Note: This article has been updated to correct the size of the round.",2017-09-05,1536009,https://tctechcrunch2011.files.wordpress.com/2017/09/event-pop.jpg?w=738,asia/,"private-equity,entrepreneurship,business,economy",Thailand’s Event Pop raises $2M to expand its ticketing service in Southeast Asia,,https://techcrunch.com/2017/09/05/thailands-event-pop-lands-1-6m/
Jon Russell,Asia,"One day after China’s decision to ban ICOs pending an investigation, Hong Kong — the country that is a special administrative region of China — has voiced concern at the growth of ICO fundraising.
ICOs, which involve the sale of newly issued crypto coins to raise money, are said to have brought in $1.6 billion in funding for companies so far this year, according to crypto industry website CoinDesk’s analytics. A recent Goldman Sachs report estimated that more money was raised in the first half of 2017 by ICOs than early stage VC firms.
Despite some promising projects, there is widespread concern around the accountability of all ICO projects and the potential for scams, money laundering and other illicit activity.
“We are concerned about an increase in the use of ICOs to raise funds in Hong Kong and elsewhere. Those involved in an ICO need to be aware that some ICO structures may be subject to Hong Kong securities laws,” Julia Leung of Hong Kong’s Securities and Futures Commission (SFC) said in a statement.
While Leung and her colleagues may be concerned, the SFC — which regulates Hong Kong’s securities and futures markets — isn’t dropping the hammer as China’s central bank did with its decision to immediately suspend ICOs and investigate around 60 companies that facilitate them.
Instead, the Hong Kong-based body has warned those who take part in ICOs, which are also known as token sales, that they may be in breach of laws if what they sell is a security. Whether ICO tokens are a security is a million billion dollar question in itself. The SEC in the U.S. and Singapore’s MAS are among other regulators to have warned those involved in ICOs of securities laws which they may be violating.
The SFC also clarified that the regulations don’t simply apply to Hong Kong-based companies holding ICOs, but any entity worldwide that sells tokens to individuals based in Hong Kong.
Regulatory concern has already prompted many companies to exclude citizens based in the U.S. and Singapore from token sales, and concerns from today’s memo may lead to others that are contemplating an ICO to add Hong Kong to that exclusion list.
That’s significant because not only is Hong Kong a major global financial hub, but it retains considerable business links with China, particularly around investment. You’d imagine, then, that today’s statement was triggered by yesterday’s China ban.
Korea is another worry for ICO companies after its financial regulator issued a crackdown that was also announced this week.
Here’s the full statement from the SFC:",2017-09-05,1535981,https://tctechcrunch2011.files.wordpress.com/2015/11/hong-kong.jpg?w=738,asia/,"icos,hong-kong",Hong Kong regulator ‘concerned’ by ICO funding boom,,https://techcrunch.com/2017/09/05/hong-kong-ico-concern/
